job_list_id,Company,Title,Link,Job,Location
885,에스넷아이씨티(주),[대전청사] 네트워크 운영 엔지니어 모집 스크랩,/zf_user/jobs/relay/view?view_type=list&rec_idx=49568357,"기술지원, 정보보안, 네트워크, 유지보수, 솔루션",대전전체 외
886,에스넷아이씨티(주),[위례] 네트워크 엔지니어 (PM) 스크랩,/zf_user/jobs/relay/view?view_type=list&rec_idx=49568350,"기술지원, 정보보안, 네트워크, 유지보수, 인프라",경기전체 외
887,(주)이지원,2025년 상반기 경력사원(웹개발) 채용공고 스크랩,/zf_user/jobs/relay/view?view_type=list&rec_idx=49622384,"웹개발, SI개발, OracleDB, ReactJS, Spring",서울 영등포구
888,(주)펀진,시계열 데이터 AI 모델 개발자 경력직 채용 스크랩,/zf_user/jobs/relay/view?view_type=list&rec_idx=49564382,"데이터분석가, SE(시스템엔지니어), 딥러닝, 머신러닝, 블록체인",서울 성동구 외
889,(주)설텍,"기술연구소 전기,전자 소프트웨어 설계 채용(10년~15년) 스크랩",/zf_user/jobs/relay/view?view_type=list&rec_idx=49561831,"FPGA, S/W, C++, C언어, 펌웨어",대구전체 외
890,(주)설텍,"기술연구소 전기,전자 소프트웨어 설계 채용(5년~10년) 스크랩",/zf_user/jobs/relay/view?view_type=list&rec_idx=49561797,"FPGA, MCU, RTOS, S/W, C++",대구전체 외
891,(주)설텍,"기술연구소 전기,전자 소프트웨어 설계 채용(1년~5년) 스크랩",/zf_user/jobs/relay/view?view_type=list&rec_idx=49561769,"FPGA, MCU, RTOS, S/W, C++",대구전체 외
892,(주)설텍,"기술연구소 전기,전자 하드웨어 설계 채용(10년~15년) 스크랩",/zf_user/jobs/relay/view?view_type=list&rec_idx=49561724,"임베디드, FPGA, H/W, MCU, RTOS",대구전체 외
893,(주)설텍,"기술연구소 전기,전자 하드웨어 설계 채용(5년~10년) 스크랩",/zf_user/jobs/relay/view?view_type=list&rec_idx=49561719,"임베디드, FPGA, H/W, MCU, RTOS",대구전체 외
894,(주)네오랩컨버전스,[NeoLAB] 재무/해외사업/상품기획/프론트엔드/생산기술 경력직 채용 스크랩,/zf_user/jobs/relay/view?view_type=list&rec_idx=49518636,"프론트엔드, CSS, HTML, Java, Javascript",서울 구로구 외
895,(주)혜성테크윈,광통신/정보통신 품질관리 및 네트워크 엔지니어 채용 스크랩,/zf_user/jobs/relay/view?view_type=list&rec_idx=49544142,"SE(시스템엔지니어), 네트워크, 인프라, DevOps, Windows",경기전체 외
896,(주)클로봇,로봇 필드 엔지니어 채용 (FE팀) 스크랩,/zf_user/jobs/relay/view?view_type=list&rec_idx=49540173,"QA/테스터, SE(시스템엔지니어), S/W, Git, Linux",경기전체 외
897,(주)엘아이지시스템,DBA (Database Administrator) 경력 직원 채용 스크랩,/zf_user/jobs/relay/view?view_type=list&rec_idx=49539930,"DBA, DBMS, RDBMS, SQL, 유지보수",서울전체 외
898,피닉슨컨트롤스(주),[대구사업장]  2차전지 검사장비(S/W) 개발 및 유지보수 채용 스크랩,/zf_user/jobs/relay/view?view_type=list&rec_idx=49539798,"DBA, S/W, C#, C++, C언어",대구전체 외
899,(주)포소드,"NVR, VMS 관련 SW 연구개발 경력 모집 스크랩",/zf_user/jobs/relay/view?view_type=list&rec_idx=49539787,"S/W, C++, C언어, 제조, 유지보수",서울전체 외
900,(주)페이타랩,[패스오더] QA Engineer (경력 11~20년 이하) 스크랩,/zf_user/jobs/relay/view?view_type=list&rec_idx=49537262,"QA/테스터, 유지보수, Jenkins, SQL, 풀스택",서울 강남구 외
901,(주)페이타랩,[패스오더] QA Engineer (경력 1~10년 이하) 스크랩,/zf_user/jobs/relay/view?view_type=list&rec_idx=49537257,"QA/테스터, 유지보수, Jenkins, SQL, 풀스택",서울 강남구 외
902,(주)페이타랩,[패스오더] Windows 개발자  (병역특례 지원가능) (경력 11~20년 이하) 스크랩,/zf_user/jobs/relay/view?view_type=list&rec_idx=49537241,"SE(시스템엔지니어), S/W, Windows, .NET, C#",서울 강남구 외
903,(주)페이타랩,[패스오더] Windows 개발자  (병역특례 지원가능) (신입~10년 이하) 스크랩,/zf_user/jobs/relay/view?view_type=list&rec_idx=49537239,"SE(시스템엔지니어), S/W, Windows, .NET, C#",서울 강남구 외
904,(주)씨나몬,유지보수 업무를 수행할 JAVA 개발자 스크랩,/zf_user/jobs/relay/view?view_type=list&rec_idx=49607672,"SI개발, 유지보수, API, Java",서울 중구
905,현대디지텍코어(주),한국교육개발원 OA 유지보수 직원 채용 스크랩,/zf_user/jobs/relay/view?view_type=list&rec_idx=49584761,"기술지원, 유지보수, H/W, 소프트웨어, 하드웨어",충북 진천군 외
906,(주)양림테크놀러지,[통신설비 유지보수]  사원 채용 스크랩,/zf_user/jobs/relay/view?view_type=list&rec_idx=49620689,"정보통신, 통신공사, 유지보수, 네트워크",강원 고성군
907,(주)모드원,[기흥/화성] 삼성전자 내 협력사 통신공사 유지보수 인원채용 스크랩,/zf_user/jobs/relay/view?view_type=list&rec_idx=49620634,"유지보수, 통신공사",경기 화성시
908,(주)잇인포소프트,팔로알토 방화벽 경력직 엔지니어 채용 합니다. 스크랩,/zf_user/jobs/relay/view?view_type=list&rec_idx=49358925,"정보보안, 네트워크, 방화벽, 유지보수",경기 의왕시
909,라온피플(주),데이터엔지니어 모집 스크랩,/zf_user/jobs/relay/view?view_type=list&rec_idx=49620302,"RDBMS, Java, NoSQL, Python, Spark",경기 과천시
910,주식회사 프레버소프트,"설비 모니터링 솔루션 개발자(Java, Java Script, Html) 모집 스크랩",/zf_user/jobs/relay/view?view_type=list&rec_idx=49584858,"기술지원, 유지보수, 솔루션, 클라우드, CSS",경기 용인시 처인구
911,(주)채움기술,"[정보통신] CCTV, 출입통제 관련 업무 사원 모집 스크랩",/zf_user/jobs/relay/view?view_type=list&rec_idx=49620091,"정보통신, 유지보수",대전 서구
912,(주)제이엠트루,보안 솔루션(방화벽 VPN 통합로그관리 ) 엔지니어 채용 스크랩,/zf_user/jobs/relay/view?view_type=list&rec_idx=49619986,"기술지원, 유지보수, 정보보안, 네트워크, 모의해킹",서울 금천구
913,(주)태성디앤에스,"전산PC, 학내망유지보수, 사무기기네트워크서비스 신입채용 스크랩",/zf_user/jobs/relay/view?view_type=list&rec_idx=49619948,"유지보수, H/W, S/W, 영업직, 네트워크영업",경기 안성시
914,블루닉스(주),IT(프로그램 개발)분야 신입/경력직 모집 스크랩,/zf_user/jobs/relay/view?view_type=list&rec_idx=49430666,"Delphi, 시스템설계, MES, 수불관리, ERP",경기 안산시 단원구
915,(주)제이투이,[SE SM 금융 여의도] Linux 서버엔지니어 유지보수   (4) 스크랩,/zf_user/jobs/relay/view?view_type=list&rec_idx=49619288,"유지보수, Linux, AWS, 서버엔지니어",서울 영등포구
916,(주)삼우이머션,[삼우이머션] 네트워크 엔지니어 정규직 경력자 모집 스크랩,/zf_user/jobs/relay/view?view_type=list&rec_idx=49619154,"기술지원, 유지보수, 네트워크, 솔루션, AR(증강현실)",부산 동구
917,(주)코어인프라,의왕시 CCTV망 및 네트워크 관제 및 유지보수 경력사원 모집 스크랩,/zf_user/jobs/relay/view?view_type=list&rec_idx=49530297,"기술지원, 정보보안, 네트워크, 방화벽, VMware",경기 의왕시
918,㈜지에스아이티엠,그룹사 SAP SCM 운영 담당자 모집 스크랩,/zf_user/jobs/relay/view?view_type=list&rec_idx=49618930,"SAP, 유지보수, ABAP",서울 종로구
919,(주)케이원,[정규직] 서대문 공공사업장 IT헬프데스크 (OA 유지보수) 스크랩,/zf_user/jobs/relay/view?view_type=list&rec_idx=49618607,"유지보수, 클라우드, 헬프데스크",서울 서대문구
920,(주)이티씨,[외국계]2025 상반기 APPLICATION ENGINEER 정규직 채용 스크랩,/zf_user/jobs/relay/view?view_type=list&rec_idx=49618138,"기술지원, 생산관리, 공정엔지니어, 기술엔지니어, 설계엔지니어",경기 의왕시
921,(주)고우아이티,Gen AI파트 SI개발 -  경력직(5년이상) 채용 스크랩,/zf_user/jobs/relay/view?view_type=list&rec_idx=49618110,".NET, C#, CSS, Javascript, MSSQL",서울 성동구 외
922,(주)오픈베이스,여의도(금융권) 상주 SE 채용 스크랩,/zf_user/jobs/relay/view?view_type=list&rec_idx=49539433,"기술지원, 네트워크, 인프라, 유지보수, 솔루션",서울 서초구
923,(주)버닛,React Native 앱 프론트엔드 개발자 스크랩,/zf_user/jobs/relay/view?view_type=list&rec_idx=49617824,"프론트엔드, S/W, Android, AWS, Git",서울 금천구
924,(주)진인프라,클라우드 엔지니어 및 사업관리 직원 채용 스크랩,/zf_user/jobs/relay/view?view_type=list&rec_idx=49617814,"보안컨설팅, 유지보수, SE(시스템엔지니어), SI개발, 네트워크",세종 세종특별자치시
925,교세라도큐먼트솔루션스코리아(주),서비스 직원 채용 [ 호남지점 ] 스크랩,/zf_user/jobs/relay/view?view_type=list&rec_idx=49617592,"유지보수, A/S기사, 기계수리, 네트워크",광주 북구
926,동아전기부품(주)공주공장,보안/전산시스템 운영 관리자 신입 및 경력 채용 스크랩,/zf_user/jobs/relay/view?view_type=list&rec_idx=49542712,"유지보수, 정보보안, 전산총무, 네트워크, 방화벽",충남 공주시
927,(주)크레아코퍼레이션,영상/음향 시스템 기술지원 및 유지보수 담당자 모집(경력직) 스크랩,/zf_user/jobs/relay/view?view_type=list&rec_idx=49438628,"기술지원, 보안컨설팅, ICT컨설팅, 영상처리, 정보통신",경남 김해시 외
928,현대디지텍코어(주),현대차 남양연구소 OA 유지보수 직원 채용 스크랩,/zf_user/jobs/relay/view?view_type=list&rec_idx=49617052,"유지보수, SE(시스템엔지니어), 트러블슈팅, H/W, pc유지보수",경기 화성시
929,(주)오픈베이스,VMware 엔지니어 채용 스크랩,/zf_user/jobs/relay/view?view_type=list&rec_idx=49525188,"네트워크, 인프라, VDI, VMware, 기술지원",서울 서초구
930,(주)코어플랫폼,(주)코어플랫폼 Android 개발자 모집 스크랩,/zf_user/jobs/relay/view?view_type=list&rec_idx=49613423,"Android, 유지보수, API, 클라이언트, Flutter",부산 해운대구
931,(주)마이렌,[Android] 안드로이드 App 개발 연구원 모집 스크랩,/zf_user/jobs/relay/view?view_type=list&rec_idx=49613294,"알고리즘, AI(인공지능), Android, iOS, 알고리즘개발",경북 영천시
932,(주)정암티에스에이치,[유지보수] 단기알바 모집 - 단순업무 입니다(서울) 스크랩,/zf_user/jobs/relay/view?view_type=list&rec_idx=49613176,유지보수,서울 송파구
933,(주)에이텍씨앤,[성남/판교] IT 유지보수 운영 담당 모집 스크랩,/zf_user/jobs/relay/view?view_type=list&rec_idx=49613133,"유지보수, 솔루션기술영업, 고객관리, 매출관리, 실적관리",경기 성남시 분당구
934,(주)정암티에스에이치,[유지보수] 단기알바 모집 - 단순업무 입니다(용인) 스크랩,/zf_user/jobs/relay/view?view_type=list&rec_idx=49613115,유지보수,경기 용인시 기흥구
935,(주)심시스글로벌,(주)심시스글로벌 웹개발자(Front-End) 정규직 채용 스크랩,/zf_user/jobs/relay/view?view_type=list&rec_idx=49613089,"웹개발, 솔루션, API, 메타버스, Docker",서울 서초구
936,(주)엔캣 브랜드 못된고양이,(주)엔캣 전산시스템 운영 경력자 모집 스크랩,/zf_user/jobs/relay/view?view_type=list&rec_idx=49612576,"유지보수, 정보보안, ERP, 네트워크, 방화벽",서울 중구
937,디딤365(주),클라우드컨설팅 영업직군 채용 스크랩,/zf_user/jobs/relay/view?view_type=list&rec_idx=49553637,"클라우드, AWS, 기술영업, 영업관리, 영업지원",서울 구로구
938,주식회사드마태,프리랜서 프론트엔드 개발자 전속 계약 모집 스크랩,/zf_user/jobs/relay/view?view_type=list&rec_idx=49612526,"프론트엔드, 프론트, UI/UX디자인, 서비스기획, 앱기획",서울 마포구 외
939,(주)투비,솔루션 엔지니어(SE) 를 모십니다. (영상관제분야 및 RPA분야) 스크랩,/zf_user/jobs/relay/view?view_type=list&rec_idx=49612509,"기술지원, 유지보수, SE(시스템엔지니어), 정보통신, 펌웨어",서울 금천구
940,인사이드(주),"사무기기(컴퓨터,복사기,프린터 외)유지보수 A/S수리원 모집 스크랩",/zf_user/jobs/relay/view?view_type=list&rec_idx=49612144,"유지보수, 거래처납품, AS",충남 천안시 서북구
941,(주)유비텍,"시스템 및 하드웨어, 네트워크 정보통신기술엔지니어 경력및신입 스크랩",/zf_user/jobs/relay/view?view_type=list&rec_idx=49612061,"유지보수, 네트워크, 정보통신, 보안장비",대구 동구
942,㈜제이플러스,[유지보수]HP프린터  플로터 스캐너 3D프린터 컴퓨터 기술지원 스크랩,/zf_user/jobs/relay/view?view_type=list&rec_idx=49469118,"기술지원, 유지보수",경기 군포시
943,(주)네트로,기술지원팀 정규직 및 계약직 모집합니다. 스크랩,/zf_user/jobs/relay/view?view_type=list&rec_idx=49611903,"기술지원, 유지보수, 네트워크",대구 수성구
944,(주)커넥트정보,[시스템 엔지니어] 기술지원 직무 경력직 채용 스크랩,/zf_user/jobs/relay/view?view_type=list&rec_idx=49606585,"기술지원, 유지보수, SE(시스템엔지니어), 네트워크, 솔루션",서울 강서구
945,교보디티에스(주),OA사무기기 유지보수 직원 모집 (종로구 근무) 스크랩,/zf_user/jobs/relay/view?view_type=list&rec_idx=49606533,"유지보수, 네트워크, H/W, S/W",서울 종로구
946,(주)디에어,드론을 활용한 데이터 수집 담당(경력무관) 스크랩,/zf_user/jobs/relay/view?view_type=list&rec_idx=49606526,"데이터라벨링, 무인항공기/드론, 자율주행, 도시교통, 측량/계측",전남 나주시
947,(주)솔로몬텍,금융네트워크 운영 및 관리 경력사원 채용 (중급) 스크랩,/zf_user/jobs/relay/view?view_type=list&rec_idx=49606332,"네트워크, 유지보수, 보안관제, 솔루션, IDC",서울 영등포구
948,(주)폴라리스에이아이,[폴라리스에이아이/대구사무소]신용협동조합 전산유지보수 채용 스크랩,/zf_user/jobs/relay/view?view_type=list&rec_idx=49606188,"유지보수, 네트워크",대구 동구
949,(주)임팩시스,"java, spring 웹개발자 경력3-7년 (대리, 팀장급) 스크랩",/zf_user/jobs/relay/view?view_type=list&rec_idx=49606138,"웹개발, API, AWS, Java, MySQL",강원 춘천시
950,(주)유피체인,퍼블리셔 경력직 모집함. 스크랩,/zf_user/jobs/relay/view?view_type=list&rec_idx=49606106,"퍼블리셔, 프론트엔드, 반응형웹, 웹표준·웹접근성, 크로스브라우징",부산 연제구
951,(주)아이피맥스,"시스템엔지니어 (AIX, Linux, Windows) 채용 공고 스크랩",/zf_user/jobs/relay/view?view_type=list&rec_idx=49605726,"Windows, CentOS, Linux, Unix, 유지보수",서울 금천구
952,㈜설텍,기술연구소 전기.전자 하드웨어 설계 경력 및 신입사원 모집. 스크랩,/zf_user/jobs/relay/view?view_type=list&rec_idx=49436828,"네트워크, 솔루션, 임베디드, FPGA, H/W",대구 달서구
953,(주)DB하이텍,[DB하이텍 & DB글로벌칩] 경력사원 공개채용 (12월) 스크랩,/zf_user/jobs/relay/view?view_type=list&rec_idx=49585114,"AI(인공지능), 공정설계, 반도체설계, 반도체, 회계",경기 부천시 외
954,패스트박스(주),[패스트박스 송림센터] 경영지원 IT 담당자 추가 채용 스크랩,/zf_user/jobs/relay/view?view_type=list&rec_idx=49427645,"정보보안, 네트워크, 방화벽, 인프라, H/W",인천 서구
955,(주)아이닉,[아이닉] 총무 및 보안 관리 보조 (팀원급) 스크랩,/zf_user/jobs/relay/view?view_type=list&rec_idx=49605219,"정보보안, 정보통신, 총무, 비품관리, 자산관리",경기 안양시 동안구
956,(주)비원시스템,"ERP/RFID 솔루션 개발자 (C#, asp, java, oracle) 모집 스크랩",/zf_user/jobs/relay/view?view_type=list&rec_idx=49309843,"ASP, C#, Java, OracleDB, 유지보수",서울 강서구
957,(주)우석이앤씨,정보통신  사무 보조원 모집함. 스크랩,/zf_user/jobs/relay/view?view_type=list&rec_idx=49605159,"네트워크, 솔루션, 인프라, 클라우드, IIS",대구 북구
958,(주)데브,AI 기반 머신비전 및  프로그램 개발자 모집(C++/C#) 스크랩,/zf_user/jobs/relay/view?view_type=list&rec_idx=49604995,"딥러닝, 머신러닝, 이미지프로세싱, WCF, 라즈베리파이",경기 안산시 단원구
959,(주)한국인프라,(주)한국인프라 공공기관 대상 솔루션 엔지니어 채용 공고 스크랩,/zf_user/jobs/relay/view?view_type=list&rec_idx=49604809,"기술지원, 네트워크, 솔루션, Windows, Linux",서울 강남구
960,렉스젠(주),[유지보수] 무인단속/CCTV 유지보수/PM 직원 모집 스크랩,/zf_user/jobs/relay/view?view_type=list&rec_idx=49604394,"기술지원, 유지보수, 네트워크",경북 안동시
961,알파(주),[유지보수] 전기 & 전산관련 업무 채용 스크랩,/zf_user/jobs/relay/view?view_type=list&rec_idx=49603952,"유지보수, 통신설계, 전기설계, 건축전기, 전기시공",경기 안성시
962,주식회사 아이세이퍼,"인공지능 및 임베디드 소프트웨어 개발자 모집(신입, 경력 무관) 스크랩",/zf_user/jobs/relay/view?view_type=list&rec_idx=49603291,"임베디드, AI(인공지능), 임베디드리눅스, 유지보수, 솔루션",서울 노원구
963,(주)아이비엠에스,"SI프로젝트 개발(중,고급 이상)경력직 채용 스크랩",/zf_user/jobs/relay/view?view_type=list&rec_idx=49603116,"유지보수, SE(시스템엔지니어), SI개발, 기술지원, 클라우드",서울 마포구
964,(주)아이비엠에스,"SI 프로젝트(민수, 공공) PM 경력직(정규직) 채용 스크랩",/zf_user/jobs/relay/view?view_type=list&rec_idx=49603100,"유지보수, SE(시스템엔지니어), SI개발, 기술지원, 클라우드",서울 마포구
965,주식회사 썬컴,해양 IT 솔루션 H/W 설치 엔지니어 채용 스크랩,/zf_user/jobs/relay/view?view_type=list&rec_idx=49352418,"기술지원, 유지보수, SI개발, 네트워크, 솔루션",부산 북구
966,이지테크,컴퓨터 및 사무기기 유지관리 직원 채용합니다 스크랩,/zf_user/jobs/relay/view?view_type=list&rec_idx=49602875,"유지보수, 컴퓨터유지보수, 사무기기유지보수",광주 북구
967,(주)한누리시스템,2025년 컴퓨터 유지보수 모집 스크랩,/zf_user/jobs/relay/view?view_type=list&rec_idx=49602829,"유지보수, H/W, 정비기사, A/S기사, 케이블설치",경남 김해시
968,(주)앤드와이즈,"소프트웨어 개발, 기술지원 및 유지보수 스크랩",/zf_user/jobs/relay/view?view_type=list&rec_idx=49602670,"기술지원, 유지보수, 퍼블리셔, 솔루션, 인프라",서울 강남구
969,(주)이엠테크,소프트웨어 솔루션 (PACS) 설치 엔지니어를 모집 (신입지원가능) 스크랩,/zf_user/jobs/relay/view?view_type=list&rec_idx=49550923,"기술지원, 유지보수, QA/테스터, SE(시스템엔지니어), 네트워크",경기 성남시 분당구
970,(주)성진에프티,전산유지보수(PC) 경력 사원 모집 스크랩,/zf_user/jobs/relay/view?view_type=list&rec_idx=49590080,"기술지원, 유지보수, 임베디드, H/W, IoT",경기 시흥시
971,(주)에이치에스이노텍,CCTV및 네트워크 공사 총괄 담당자 채용 스크랩,/zf_user/jobs/relay/view?view_type=list&rec_idx=49584822,"유지보수, SE(시스템엔지니어), 네트워크, 인프라, 정보통신",충남 천안시 외
972,엔큐리티(주),네트워크(L4-L7) 솔루션 엔지니어 경력직(3~5년) 채용 [강소기업] 스크랩,/zf_user/jobs/relay/view?view_type=list&rec_idx=49585368,"기술지원, 보안컨설팅, 유지보수, 정보보안, CISO",경기 성남시 분당구 외
973,엔큐리티(주),네트워크(L4-L7) 솔루션 엔지니어 경력직(6~8년) 채용 [강소기업] 스크랩,/zf_user/jobs/relay/view?view_type=list&rec_idx=49585442,"기술지원, 보안컨설팅, 유지보수, 정보보안, CISO",경기 성남시 분당구 외
974,엔큐리티(주),네트워크(L4-L7) 솔루션 엔지니어 경력직(9~10년) 채용 [강소기업] 스크랩,/zf_user/jobs/relay/view?view_type=list&rec_idx=49585460,"기술지원, 보안컨설팅, 유지보수, 정보보안, CISO",경기 성남시 분당구 외
975,(주)엘리스그룹,백엔드 엔지니어 (Python) 채용 스크랩,/zf_user/jobs/relay/view?view_type=list&rec_idx=49576848,"백엔드/서버개발, RDBMS, Docker, Git, Java",서울 강남구 외
976,(주)소테리아,Front-End Design 엔지니어 채용(책임~수석) [ASIC] 스크랩,/zf_user/jobs/relay/view?view_type=list&rec_idx=49574114,"프론트엔드, SI개발, 네트워크, 딥러닝, 블록체인",경기 성남시 수정구 외
977,에이치엘비이엔지(주),전산담당자 신입/경력직원(사원~대리급) 모집 스크랩,/zf_user/jobs/relay/view?view_type=list&rec_idx=49576850,"기술지원, 보안컨설팅, 유지보수, 정보보안, CISO",울산 울주군
978,동성건설㈜,2024년 동성건설㈜ 각 부문별 신입/경력 채용 스크랩,/zf_user/jobs/relay/view?view_type=list&rec_idx=49569989,"기술지원, 유지보수, 파워빌더, OracleDB, SQL",대전 유성구 외
979,(주)유리네트웍스,[인천]네트워크/보안/통합관제 엔지니어 모집 스크랩,/zf_user/jobs/relay/view?view_type=list&rec_idx=49589839,"유지보수, H/W, IoT, 네트워크",인천 연수구
980,(주)파워테크닉,"출입보안시스템(출입통제, CCTV) 유지보수 직원 채용(서울/인천) 스크랩",/zf_user/jobs/relay/view?view_type=list&rec_idx=49561840,"기술지원, 유지보수, 네트워크, 정보통신, 통신설계",서울 구로구 외
981,(주)파워테크닉,"출입보안시스템(출입통제, CCTV)유지보수 경력 채용(천안, 아산) 스크랩",/zf_user/jobs/relay/view?view_type=list&rec_idx=49561864,"기술지원, 유지보수, 네트워크, 정보통신, 통신설계",충남 천안시 서북구 외
982,(주)파워테크닉,"출입보안시스템(출입통제, CCTV) 유지보수 신입/경력 채용(송도 파견) 스크랩",/zf_user/jobs/relay/view?view_type=list&rec_idx=49561878,"기술지원, 유지보수, 네트워크, 정보통신, 통신설계",인천 연수구 외
983,(주)엠티씨엠,부산지역 공공기관 Front-end 개발자 모집 공고 스크랩,/zf_user/jobs/relay/view?view_type=list&rec_idx=49553152,프론트엔드,부산 부산진구
984,(주)인스틴솔루션,AV시스템 유지보수 및 설치 인력 채용 스크랩,/zf_user/jobs/relay/view?view_type=list&rec_idx=49581883,유지보수,서울 성동구
985,DPS,함께 성장해나갈 머신비전 개발자를 모심. 스크랩,/zf_user/jobs/relay/view?view_type=list&rec_idx=49581778,".NET, C#, C++, Git, OpenCV",경기 군포시
986,강호정보통신(주),프로젝트 관리팀 기술지원 정규직 채용 (강원도청 상주근무) 스크랩,/zf_user/jobs/relay/view?view_type=list&rec_idx=49581673,"기술지원, 유지보수, 솔루션, 상주근무",강원 춘천시
987,(주)엠트리센,솔루션 운영/기술지원 정규직 채용 스크랩,/zf_user/jobs/relay/view?view_type=list&rec_idx=49566471,"기술지원, 유지보수, Windows, Linux, Node.js",서울 금천구
988,시스트로닉스(주),C# 응용프로그램 개발자 채용 (10년차 이상/2차) 스크랩,/zf_user/jobs/relay/view?view_type=list&rec_idx=49581293,"C#, MariaDB, MySQL, RestAPI, WPF",경기 부천시
989,(주)하나비젼씨스템즈,PM_공사관리/CCTV/에어컨 설치 및 A/S 정규직  채용 스크랩,/zf_user/jobs/relay/view?view_type=list&rec_idx=49543942,"기술지원, 유지보수, 정보통신, 사무직, 서무",인천 연수구 외
990,아람주식회사,[웹에이전시(사)] 디자인&퍼블리싱  신입/경력직  채용공고 스크랩,/zf_user/jobs/relay/view?view_type=list&rec_idx=49581167,"퍼블리셔, 웹표준·웹접근성, CSS, HTML, Javascript",서울 금천구
991,(주)에스티에이테스팅컨설팅,테스트자동화 엔지니어(팀장급) 인재채용 스크랩,/zf_user/jobs/relay/view?view_type=list&rec_idx=49428799,"기술지원, 데이터분석가, 유지보수, IT컨설팅, QA/테스터",서울 광진구
992,(주)서경산업,"제주 ITS 및 교통신호시스템 기술지원, 유지보수 경력직 채용 스크랩",/zf_user/jobs/relay/view?view_type=list&rec_idx=49580886,"기술지원, 유지보수, 정보통신, 기계수리",제주 제주시
993,유닉솔루션(주),유닉솔루션(주) 기업 비즈니스 플랫폼 테스트 엔지니어 채용 스크랩,/zf_user/jobs/relay/view?view_type=list&rec_idx=49580716,"SQA, 유지보수, S/W",서울 마포구
994,엠클라우드브리지(주),MS 데이터엔지니어(Fabric/ML) 채용 스크랩,/zf_user/jobs/relay/view?view_type=list&rec_idx=49580574,"데이터분석가, 데이터엔지니어, 데이터시각화, 머신러닝, 모델링",서울 강남구
995,(주)인투정보,네트워크 보안 엔지니어 모집 (신입/경력) 스크랩,/zf_user/jobs/relay/view?view_type=list&rec_idx=49394690,"기술지원, 유지보수, 정보보안, 네트워크, 방화벽",서울 금천구
996,(주)페르미,시스템 엔지니어 (기술지원) 신입 및 경력 모집 스크랩,/zf_user/jobs/relay/view?view_type=list&rec_idx=49566876,"기술지원, SE(시스템엔지니어), 솔루션, 클라우드, Azure",서울 강남구
997,(주)윌네트,KAI 정보시스템 Infra (네트워크 엔지니어) 스크랩,/zf_user/jobs/relay/view?view_type=list&rec_idx=49580293,"네트워크, 정보통신, 유지보수",경남 사천시
