job_list_id,Company,Title,Link,Job,Location
1337,(주)필라테크,멀티캠퍼스 구미교육장 전산장비 및 강의장 관리 경력자 채용 스크랩,/zf_user/jobs/relay/view?view_type=list&rec_idx=49620653,"기술지원, 유지보수",경북 구미시 외
1338,(주)비전스페이스,로봇 SW 개발 및 제어 엔지니어 & 로봇 AI RAG 개발 스크랩,/zf_user/jobs/relay/view?view_type=list&rec_idx=49663211,"백엔드/서버개발, 데이터시각화, 딥러닝, 머신러닝, 모델링",서울 강남구
1339,카시아속초호텔앤리조트주식회사,반얀그룹 카시아속초 IT Manager 채용 스크랩,/zf_user/jobs/relay/view?view_type=list&rec_idx=49665800,"기술지원, 유지보수, 정보보안, IT컨설팅, ICT컨설팅",강원 속초시 외
1340,㈜씨앤씨,"데이터,하드 복구 경력 청주 본사 스크랩",/zf_user/jobs/relay/view?view_type=list&rec_idx=49665557,"유지보수, 솔루션, 임베디드, FPGA, H/W",충북 청주시 흥덕구
1341,티엠파크,저축은행중앙회 통합콜센터 상담 모집 스크랩,/zf_user/jobs/relay/view?view_type=list&rec_idx=49514341,"기술지원, 유지보수, 사무직, 문서작성, 사무보조",서울 강북구 외
1342,(주)아이브,Deep Learning Platform Engineer 스크랩,/zf_user/jobs/relay/view?view_type=list&rec_idx=49657079,"웹개발, SE(시스템엔지니어), 딥러닝, 머신러닝, 빅데이터",서울 서초구 외
1343,(주)아파트아이,DBA (시니어) 스크랩,/zf_user/jobs/relay/view?view_type=list&rec_idx=49655316,"웹개발, DBA, DBMS, RDBMS, MSSQL",서울전체 외
1344,(주)유도,(주)유도 신입 및 경력사원 모집 스크랩,/zf_user/jobs/relay/view?view_type=list&rec_idx=49648294,"백엔드/서버개발, 펌웨어, ERP, ASP, ASP.NET",경기 화성시 외
1345,콘센트릭스서비스코리아(유),비즈니스 컨설턴트 (Data 분석) 스크랩,/zf_user/jobs/relay/view?view_type=list&rec_idx=49652840,"데이터분석가, 데이터엔지니어, 빅데이터, 데이터분석, 솔루션",서울 강남구
1346,콘센트릭스서비스코리아(유),전자 대기업 글로벌 커머스 플랫폼 구축/운영 BA 스크랩,/zf_user/jobs/relay/view?view_type=list&rec_idx=49652710,"웹개발, 솔루션, SAP, 이커머스개발",서울 강남구
1347,콘센트릭스서비스코리아(유),시각화 개발자 (사원급) 스크랩,/zf_user/jobs/relay/view?view_type=list&rec_idx=49651213,"데이터분석가, 데이터엔지니어, 데이터라벨링, 데이터마이닝, 데이터시각화",서울 강남구
1348,(주)이노그리드,[이노그리드] 클라우드 연구센터 QA 경력 채용 스크랩,/zf_user/jobs/relay/view?view_type=list&rec_idx=49652391,"유지보수, QA/테스터, 정보통신, 클라우드, 솔루션",서울 중구
1349,(주)애드,(대전 오피스) - 애드(addd) 각 부서별 채용 스크랩,/zf_user/jobs/relay/view?view_type=list&rec_idx=49665142,"웹개발, Git, Node.js, React, TypeScript",대전 유성구
1350,(주)리더마인,웹에이전시 프론트개발 시니어 채용 스크랩,/zf_user/jobs/relay/view?view_type=list&rec_idx=49531957,"프론트엔드, API, CSS, Git, HTML",서울 강남구
1351,㈜와이즈넛,솔루션개발직(판교본사/중부지역) 경력사원 모집 건 스크랩,/zf_user/jobs/relay/view?view_type=list&rec_idx=49664787,"웹개발, Java, 검색엔진, 빅데이터, 챗봇",경기 성남시 분당구 외
1352,(주)웍스메이트,[Worksmate Inc.] Jr. Cloud Engineer 스크랩,/zf_user/jobs/relay/view?view_type=list&rec_idx=49664628,"앱개발, 인프라, 네트워크, 스크립트, AWS",서울 서초구
1353,(주)제이투이,[JAVA/SAPUI5 SI 양재]  Sales Potar 개발(6) 스크랩,/zf_user/jobs/relay/view?view_type=list&rec_idx=49664473,"웹개발, SAP, AWS, HTML, Java",서울 서초구
1354,코닝나노프로텍(주),코닝나노프로텍 머신비전/딥러닝 기반 검사 장비 SW 개발자 모집 스크랩,/zf_user/jobs/relay/view?view_type=list&rec_idx=49664377,"앱개발, SE(시스템엔지니어), 딥러닝, 알고리즘, 영상처리",대전 유성구
1355,(주)어픽,Java·JSP 웹 소프트웨어 개발자 정규직 채용(경력무관) 스크랩,/zf_user/jobs/relay/view?view_type=list&rec_idx=49664374,"웹개발, Ajax, Java, JSP",인천 중구
1356,주식회사바이트블룸,"PC 엔지니어 채용 (납품,설치,AS) 스크랩",/zf_user/jobs/relay/view?view_type=list&rec_idx=49569804,"기술지원, 유지보수",서울 송파구
1357,(주)제이투이,[JAVA SM 서울역]결제서비스 시스템 운영 및 개발 (3) 스크랩,/zf_user/jobs/relay/view?view_type=list&rec_idx=49664193,"웹개발, .NET, Java, MSSQL, Node.js",서울 중구
1358,(주)먼슬리키친,[벡엔드개발] 정산결제/백오피스/nest.js 등 스크랩,/zf_user/jobs/relay/view?view_type=list&rec_idx=49663901,"백엔드/서버개발, API, AWS",서울 강남구
1359,(주)브라이센코리아,[경력] UI / UX 웹 디자인 & 웹 퍼블리싱 채용 스크랩,/zf_user/jobs/relay/view?view_type=list&rec_idx=49660974,"퍼블리셔, 프론트엔드, 빅데이터, S/W, CSS",경기 수원시 팔달구
1360,에이치제이네트웍스,풀스택 개발 경력자 모집 (파주) 스크랩,/zf_user/jobs/relay/view?view_type=list&rec_idx=49625302,"유지보수, Java, Jenkins, JSP, Linux",경기 파주시 외
1361,(주)로보티즈,[자율주행로봇] 로봇관제 시스템 WEB 백엔드 개발자 스크랩,/zf_user/jobs/relay/view?view_type=list&rec_idx=49620805,"백엔드/서버개발, PHP, API, Docker, Kafka",서울 강서구
1362,에이엠(주),SW System 개발 (신입~경력4년) 스크랩,/zf_user/jobs/relay/view?view_type=list&rec_idx=49603218,"앱개발, SE(시스템엔지니어), 펌웨어, RTOS, S/W",경기전체 외
1363,에이엠(주),전장 Middleware SW 개발자 (경력10~15년) 스크랩,/zf_user/jobs/relay/view?view_type=list&rec_idx=49603494,"앱개발, SE(시스템엔지니어), 임베디드, S/W, Android",경기전체 외
1364,(주)메디플렉서스,의료 데이터 베이스 (DB) 구축 정규직 채용 스크랩,/zf_user/jobs/relay/view?view_type=list&rec_idx=49637040,"웹개발, DBA, SE(시스템엔지니어), DBMS, RDBMS",서울 마포구 외
1365,에이엠(주),SW System 개발 (경력5~9년) 스크랩,/zf_user/jobs/relay/view?view_type=list&rec_idx=49603224,"앱개발, SE(시스템엔지니어), 펌웨어, RTOS, S/W",경기전체 외
1366,에이엠(주),SW System 개발 (경력10~15년) 스크랩,/zf_user/jobs/relay/view?view_type=list&rec_idx=49603233,"앱개발, SE(시스템엔지니어), 펌웨어, RTOS, S/W",경기전체 외
1367,에이엠(주),전장 Middleware SW 개발자 (경력5~9년) 스크랩,/zf_user/jobs/relay/view?view_type=list&rec_idx=49603497,"앱개발, SE(시스템엔지니어), 임베디드, S/W, Android",경기전체 외
1368,에이엠(주),전장 Middleware SW 개발자 (신입~경력4년) 스크랩,/zf_user/jobs/relay/view?view_type=list&rec_idx=49603499,"앱개발, SE(시스템엔지니어), 임베디드, S/W, Android",경기전체 외
1369,주식회사헤익스(HAIXInc.),모바일 개발자 모집 (경력 3년~19년) 스크랩,/zf_user/jobs/relay/view?view_type=list&rec_idx=49638137,"앱개발, Android, Flutter, iOS, 솔루션",서울 서초구 외
1370,(주)리슨코리아,[경기] 영상음향 및 LED 전광판 관련 기술지원 정규직원 채용 스크랩,/zf_user/jobs/relay/view?view_type=list&rec_idx=49649270,"기술지원, 유지보수, IT컨설팅, ICT컨설팅, 솔루션",경기 성남시 중원구
1371,국가보안기술연구소,2025년도 2차 계약직(SW3 분야) 채용 스크랩,/zf_user/jobs/relay/view?view_type=list&rec_idx=49643474,"백엔드/서버개발, 보안컨설팅, 정보보안, 인터페이스, Docker",대전 유성구
1372,(주)부산정보통신,[신용카드단말기/포스기] 영업부 2025년 상반기 정규채용 스크랩,/zf_user/jobs/relay/view?view_type=list&rec_idx=49643362,"유지보수, 기술영업",부산 연제구
1373,위즈코어(주),데이터 사업부 솔루션 SM 개발자를 모집합니다.(Full-stack) 스크랩,/zf_user/jobs/relay/view?view_type=list&rec_idx=49643034,"웹개발, S/W, Java, JSP, 솔루션",서울 강남구
1374,현우산업(주),전산팀 경력사원 모집 스크랩,/zf_user/jobs/relay/view?view_type=list&rec_idx=49503205,"기술지원, 유지보수, 정보보안, CISO, 네트워크",인천 서구
1375,주식회사 모우다,[모우다] 웹개발자(백엔드) 모집합니다. 스크랩,/zf_user/jobs/relay/view?view_type=list&rec_idx=49579268,"백엔드/서버개발, 솔루션, 인프라, API",서울 영등포구
1376,(주)에이아이매틱스,에이아이매틱스 백엔드 개발자(팀장급) 채용 스크랩,/zf_user/jobs/relay/view?view_type=list&rec_idx=49629904,"백엔드/서버개발, API, AWS, Java, Javascript",경기 성남시 분당구 외
1377,(주)한결피아이에프,"IT기술지원, SAN 엔지니어 채용(세종) 스크랩",/zf_user/jobs/relay/view?view_type=list&rec_idx=49642520,"기술지원, 유지보수, 인프라, H/W, Linux",세종 세종특별자치시
1378,(주)한결피아이에프,"IT기술지원, SAN 엔지니어 채용(서울) 스크랩",/zf_user/jobs/relay/view?view_type=list&rec_idx=49642517,"기술지원, 유지보수, 인프라, H/W, Linux",서울 성동구
1379,주식회사 앱솔루션,앱솔루션에서 신나게 앱을 제작하실 Flutter 개발자 모집합니다. 스크랩,/zf_user/jobs/relay/view?view_type=list&rec_idx=49642469,"앱개발, Flutter",부산 해운대구
1380,파킹클라우드(주),AS3팀 AS담당자 계약직 채용 스크랩,/zf_user/jobs/relay/view?view_type=list&rec_idx=49574601,"유지보수, 정비기사, A/S기사, 고객응대, 기계수리",경기 광명시
1381,주식회사퍼스트워크,"25년 신규직원모집(서비스데스크, 장애관제) 스크랩",/zf_user/jobs/relay/view?view_type=list&rec_idx=49635117,"기술지원, 보안컨설팅, 유지보수, 정보보안, 네트워크",대전 유성구 외
1382,(주)제이솔루션,(주)제이솔루션 창원지사 총무팀 인재 채용 스크랩,/zf_user/jobs/relay/view?view_type=list&rec_idx=49635049,"기술지원, 유지보수, 정보보안, 네트워크, 정보통신",경남 창원시
1383,국립암센터,국립암센터  데이터 구축팀 과제연구원 채용 스크랩,/zf_user/jobs/relay/view?view_type=list&rec_idx=49634854,"데이터엔지니어, 빅데이터, DBMS, ETL, SAP",경기 고양시 일산동구
1384,㈜신성씨앤티,IT 기획 및 운영 담당자 모집 (ERP/MES) - 팀원급 스크랩,/zf_user/jobs/relay/view?view_type=list&rec_idx=49634770,"유지보수, 정보보안, IT컨설팅, 네트워크, ERP",서울 금천구
1385,(주)휴먼정보,국가정보자원관리원 운영 인력 모집 스크랩,/zf_user/jobs/relay/view?view_type=list&rec_idx=49634666,"유지보수, 네트워크, 인프라",대전 유성구
1386,(주)프라임엔시스템,보안 장비 및 솔루션 운영(서울) 스크랩,/zf_user/jobs/relay/view?view_type=list&rec_idx=49423243,"유지보수, 네트워크, H/W, S/W, 솔루션",서울 강서구
1387,와이즈와이어즈(주),[와이즈와이어즈] 시험인증 테스트 엔지니어 모집 스크랩,/zf_user/jobs/relay/view?view_type=list&rec_idx=49634262,"웹개발, 웹마스터, QA/테스터, Azure, C#",서울 성동구
1388,와이즈와이어즈(주),[와이즈와이어즈] 소프트웨어테스트엔지니어(SQA) 리더 채용 스크랩,/zf_user/jobs/relay/view?view_type=list&rec_idx=49634231,"웹마스터, 프론트엔드, IT컨설팅, QA/테스터, ICT컨설팅",서울 성동구
1389,양산컨트리클럽,전산직원 채용(정규직) 스크랩,/zf_user/jobs/relay/view?view_type=list&rec_idx=49450793,"유지보수, SE(시스템엔지니어)",경남 양산시
1390,펜타시큐리티(주),글로벌 프리세일즈 엔지니어 모집 스크랩,/zf_user/jobs/relay/view?view_type=list&rec_idx=49634082,"기술지원, 보안컨설팅, 유지보수, 정보보안, IT컨설팅",서울 영등포구
1391,펜타시큐리티(주),글로벌 프리세일즈 엔지니어 모집(경력) 스크랩,/zf_user/jobs/relay/view?view_type=list&rec_idx=49634066,"기술지원, 보안컨설팅, 유지보수, 정보보안, IT컨설팅",서울 영등포구
1392,에어인천(주),IT기획팀 신규채용 스크랩,/zf_user/jobs/relay/view?view_type=list&rec_idx=49634059,"백엔드/서버개발, ICT컨설팅, ERP, SAP, ABAP",서울 강서구
1393,마린웍스(주),"IoT, 제어, 빅데이타 및 C# 기반 어플리케이션 개발자 채용 스크랩",/zf_user/jobs/relay/view?view_type=list&rec_idx=49634041,"웹개발, ICT컨설팅, 네트워크, 머신러닝, 빅데이터",서울 종로구 외
1394,(주)에이티아이케이,반도체 공정 설비 기술엔지니어 (신입/경력) 스크랩,/zf_user/jobs/relay/view?view_type=list&rec_idx=49445987,"기술지원, 유지보수, 기계수리",경기 화성시 외
1395,메이저월드(주),[메이저월드(주)] PHP개발자 모집 스크랩,/zf_user/jobs/relay/view?view_type=list&rec_idx=49633881,"웹개발, Javascript, MySQL, PHP, API",경기 화성시 외
1396,(주)튠시스템,"공공기관 PC관리 상주모집(안양, 군포, 의왕 지역 내 공공기관) 스크랩",/zf_user/jobs/relay/view?view_type=list&rec_idx=49633741,"유지보수, 네트워크, H/W, S/W",경기 안양시 동안구
1397,현대오토에버(주),차량SW · ICT · 경영지원 부문 채용 스크랩,/zf_user/jobs/relay/view?view_type=list&rec_idx=47669139,"기술지원, 데이터분석가, 백엔드/서버개발, 보안컨설팅, 정보보안",서울 강남구 외
1398,템프인(주),[원흥/월209만/신입O/단기3개월]유명기업 PC조립 업무 채용 스크랩,/zf_user/jobs/relay/view?view_type=list&rec_idx=49615758,"기술지원, 유지보수, 정보보안, 네트워크, 방화벽",경기 고양시 덕양구
1399,투아이시스(주),투아이시스(주) 머신비전 [제어]SW개발자 모집(신입지원가능) 스크랩,/zf_user/jobs/relay/view?view_type=list&rec_idx=49439840,"데이터분석가, 데이터엔지니어, SE(시스템엔지니어), 네트워크, 머신러닝",경기 군포시
1400,(주)온코크로스,플랫폼 기술 연구 및 웹백엔드 개발자 채용 스크랩,/zf_user/jobs/relay/view?view_type=list&rec_idx=49629876,"데이터분석가, 데이터엔지니어, 데이터마이닝, 딥러닝, 머신러닝",서울 송파구
1401,선박해양플랜트연구소,2024년 하반기 정규직(연구직) 공개채용(친환경 선박 성능추정) 스크랩,/zf_user/jobs/relay/view?view_type=list&rec_idx=49617894,"데이터분석가, 데이터엔지니어, 빅데이터, 연구원, CAD",대전 유성구
1402,선박해양플랜트연구소,2024년 하반기 정규직(기술직) 공개채용(데이터 관리) 스크랩,/zf_user/jobs/relay/view?view_type=list&rec_idx=49618472,"데이터분석가, 데이터엔지니어, SQL, 연구원, 기술연구",대전 유성구
1403,선박해양플랜트연구소,2024년 하반기 비정규직(계약직연구원) 공개채용(인프라 기술) 스크랩,/zf_user/jobs/relay/view?view_type=list&rec_idx=49617661,"데이터분석가, 데이터엔지니어, 알고리즘, 인프라, AI(인공지능)",대전 유성구
1404,주식회사 씨드투,[주식회사 씨드투] 백앤드 개발자 채용 스크랩,/zf_user/jobs/relay/view?view_type=list&rec_idx=49629845,"백엔드/서버개발, Javascript, ReactJS, 풀스택, 솔루션",서울 강남구
1405,블루바이저시스템즈,[블루바이저] 안드로이드 개발자  채용 (서울) 스크랩,/zf_user/jobs/relay/view?view_type=list&rec_idx=49473039,"웹개발, Android, 솔루션",서울 강남구
1406,(주)피엘시스템즈,(OP)행정기관/공공기관 정보시스템 모니터링 경력자 채용 스크랩,/zf_user/jobs/relay/view?view_type=list&rec_idx=49614911,"유지보수, 보안관제, 솔루션",서울 종로구
1407,(주)엔에프,(주)엔에프 2024년 CRM팀(서비스관리) 채용 (본사/부산) 스크랩,/zf_user/jobs/relay/view?view_type=list&rec_idx=49629330,"유지보수, A/S기사, 고객응대, 기계수리, 설비점검",부산 기장군
1408,(주)엔에프,(주)엔에프 2024년 CRM팀 채용 (성남/성남지사) 스크랩,/zf_user/jobs/relay/view?view_type=list&rec_idx=49542953,"유지보수, A/S기사, 설비점검, 솔루션, 헬스케어",경기 성남시 분당구
1409,(주)엔에프,(주)엔에프 2024년 CRM팀(제품 설치) 채용 (본사/부산) 스크랩,/zf_user/jobs/relay/view?view_type=list&rec_idx=49391546,"유지보수, A/S기사, 고객응대, 기계수리, 설비점검",부산 기장군
1410,(주)포어링크,[신입/경력] KT 천안 CDC센터 네트워크 운영엔지니어 모집 스크랩,/zf_user/jobs/relay/view?view_type=list&rec_idx=49629252,"유지보수, 네트워크, IDC",충남 천안시 동남구
1411,(주)벤처씨엔씨프라자,[마이크로소프트 Agent] 기술지원 업무 경력직 모집 스크랩,/zf_user/jobs/relay/view?view_type=list&rec_idx=49629240,"기술지원, 유지보수, 솔루션, 트러블슈팅, Windows",서울 중구
1412,(주)한결이앤씨,[한결이엔씨] 경영지원팀  인사/노무/경리/회계 업무 담당 스크랩,/zf_user/jobs/relay/view?view_type=list&rec_idx=49628376,"유지보수, 경리, 계산서발행, 급여(Payroll), 법인결산",서울 서초구
1413,엔에이치엔한국사이버결제 주식회사,[NHN KCP] 백업 시스템 관리 담당 모집 (10년 이하) 스크랩,/zf_user/jobs/relay/view?view_type=list&rec_idx=49627876,"데이터분석가, 데이터엔지니어, DBA, 기술지원, 솔루션",서울 구로구
1414,펑타이그레이터차이나(유),글로벌 빅데이터 플랫폼 BI 대시보드 기획/운영 (Data Analysis) 스크랩,/zf_user/jobs/relay/view?view_type=list&rec_idx=49532155,"데이터분석가, 백엔드/서버개발, 모델링, 빅데이터, AWS",서울 강남구
1415,펑타이그레이터차이나(유),글로벌 빅데이터 플랫폼 BI 백엔드 개발/운영 (Back-End) 스크랩,/zf_user/jobs/relay/view?view_type=list&rec_idx=49532176,"백엔드/서버개발, 빅데이터, 클라우드, DW, AWS",서울 강남구
1416,펑타이그레이터차이나(유)영업소,[PTKOREA] 글로벌 D2C시스템 운영 PMO 스크랩,/zf_user/jobs/relay/view?view_type=list&rec_idx=49627457,"백엔드/서버개발, 개발PM, 클라이언트, Docker",서울 강남구
1417,(주)제이투이,[NODE.JS SI 성수]자사솔루션 BACK-END 개발 (5) 스크랩,/zf_user/jobs/relay/view?view_type=list&rec_idx=49627427,"백엔드/서버개발, AWS, Node.js",서울 성동구
1418,보타리에너지(주),"S/W개발자 채용(펌웨어,UI프로그래머) 스크랩",/zf_user/jobs/relay/view?view_type=list&rec_idx=49430500,"백엔드/서버개발, 펌웨어",제주 제주시
1419,에릭슨엘지(주),[Ericsson-LG] Support Engineer (5G Packet Core) 신입 채용 스크랩,/zf_user/jobs/relay/view?view_type=list&rec_idx=49511860,"기술지원, 유지보수, IT컨설팅, 네트워크, 정보통신",서울 금천구
1420,(주)에이핀테크놀러지,LG 에너지솔루션 MES 및 활성화 개발 프로젝트 채용 [경력 6~10년] 스크랩,/zf_user/jobs/relay/view?view_type=list&rec_idx=49535407,"웹개발, DBA, S/W, C#, Java",서울전체 외
1421,(주)빗썸코리아,SRE엔지니어 스크랩,/zf_user/jobs/relay/view?view_type=list&rec_idx=49534711,"웹개발, SE(시스템엔지니어), 딥러닝, 머신러닝, 인프라",서울 강남구 외
1422,(주)이파피루스,솔루션 엔지니어(시스템 엔지니어/SE) 채용 스크랩,/zf_user/jobs/relay/view?view_type=list&rec_idx=49533772,"기술지원, 웹개발, SE(시스템엔지니어), 네트워크, 인프라",경기전체 외
1423,(주)티사이언티픽,네트워크 관제 솔루션 구축 엔지니어 채용 스크랩,/zf_user/jobs/relay/view?view_type=list&rec_idx=49532662,"웹개발, DBA, SE(시스템엔지니어), 네트워크, 인프라",서울 동작구 외
1424,(주)딥노이드,AI연구원 (Computer Vision AI) 스크랩,/zf_user/jobs/relay/view?view_type=list&rec_idx=49529116,"데이터분석가, 웹개발, SE(시스템엔지니어), 딥러닝, 머신러닝",서울전체 외
1425,(주)폴라리스쓰리디,이리온 Flutter App 개발자 스크랩,/zf_user/jobs/relay/view?view_type=list&rec_idx=49527140,"앱개발, Android, Flutter, iOS, Linux",경북 포항시 외
1426,(주)베스티안소프트,퍼블리셔 경력자 모집 스크랩,/zf_user/jobs/relay/view?view_type=list&rec_idx=49622170,"웹개발, 퍼블리셔, CSS, CSS3, Git",서울 용산구
1427,(주)한국네트웍스,물류시스템 개발 PL [경력 16년 ~ 20년] 스크랩,/zf_user/jobs/relay/view?view_type=list&rec_idx=49525947,"웹개발, DBA, SE(시스템엔지니어), 인프라, DevOps",경기전체 외
1428,(주)한국네트웍스,물류시스템 개발 PL [경력 11년 ~ 15년] 스크랩,/zf_user/jobs/relay/view?view_type=list&rec_idx=49525948,"웹개발, DBA, SE(시스템엔지니어), 인프라, DevOps",경기전체 외
1429,(주)한국네트웍스,물류시스템 개발 PL [경력 6년 ~ 10년] 스크랩,/zf_user/jobs/relay/view?view_type=list&rec_idx=49525938,"웹개발, DBA, SE(시스템엔지니어), 인프라, DevOps",경기전체 외
1430,(주)지엔,IoT 보안 R&D 팀장급 채용 스크랩,/zf_user/jobs/relay/view?view_type=list&rec_idx=49524915,"웹개발, SE(시스템엔지니어), 클라우드, S/W, Docker",서울전체 외
1431,(주)오래,[제로아이즈] iOS App 개발자 스크랩,/zf_user/jobs/relay/view?view_type=list&rec_idx=49524728,"앱개발, Android, Flutter, iOS, Kotlin",부산전체 외
1432,(주)모빌린트,[전문연구원 가능] SoC Design Engineer 스크랩,/zf_user/jobs/relay/view?view_type=list&rec_idx=49524460,"웹개발, 임베디드, FPGA, H/W, C++",서울 강남구 외
1433,이노아이(주),광고 플랫폼 테스트 엔지니어 [분당서현역] (8~10년) 스크랩,/zf_user/jobs/relay/view?view_type=list&rec_idx=49514855,"앱개발, QA/테스터, Android, iOS, Kotlin",경기 이천시 외
1434,이노아이(주),광고 플랫폼 테스트 엔지니어 [분당서현역] (6~8년) 스크랩,/zf_user/jobs/relay/view?view_type=list&rec_idx=49514856,"앱개발, QA/테스터, Android, iOS, Kotlin",경기전체 외
1435,이노아이(주),광고 플랫폼 테스트 엔지니어 [분당서현역] (4~6년) 스크랩,/zf_user/jobs/relay/view?view_type=list&rec_idx=49514859,"앱개발, QA/테스터, Android, iOS, Kotlin",경기전체 외
1436,이노아이(주),광고 플랫폼 테스트 엔지니어 [분당서현역] (3~4년) 스크랩,/zf_user/jobs/relay/view?view_type=list&rec_idx=49514860,"앱개발, QA/테스터, Android, iOS, Kotlin",경기전체 외
1437,에이에스이천안(주),FI 시스템 개발 엔지니어 경력직 채용 (경력 5년이상) 스크랩,/zf_user/jobs/relay/view?view_type=list&rec_idx=49598390,"기술지원, 웹개발, DBA, SE(시스템엔지니어), 인프라",충남 천안시 외
1438,스왈라비(주),IOS 개발자 스크랩,/zf_user/jobs/relay/view?view_type=list&rec_idx=49507081,"앱개발, iOS, Swift, 빅데이터, 솔루션",서울 강남구 외
1439,(주)이엘피,연구소 응용S/W 개발자(연구원) 경력 모집 스크랩,/zf_user/jobs/relay/view?view_type=list&rec_idx=49505495,"앱개발, S/W, Android, C#, MFC",경기전체 외
1440,채비(주),R&D UI 경력자 채용 스크랩,/zf_user/jobs/relay/view?view_type=list&rec_idx=49505290,"웹개발, 퍼블리셔, SE(시스템엔지니어), 웹표준·웹접근성, S/W",경북전체 외
1441,(주)제이투이,"[EAI SM 서울역] 차세대 택배시스템 운영, 고급 (3) 스크랩",/zf_user/jobs/relay/view?view_type=list&rec_idx=49622048,"웹개발, 인터페이스, AWS, Git, EAI",서울 용산구
1442,(주)슈프리마,[슈프리마] 해외 기술 컨설팅 엔지니어 - SDK 기술지원 담당자 스크랩,/zf_user/jobs/relay/view?view_type=list&rec_idx=49494757,"기술지원, 웹개발, C#, Java, Python",경기전체 외
1443,주식회사 빅밸류,[빅밸류] Data Scientist(공통) 모집 스크랩,/zf_user/jobs/relay/view?view_type=list&rec_idx=49417709,"데이터분석가, 데이터엔지니어, 데이터마이닝, 데이터 사이언티스트, 빅데이터",서울 중구
1444,피엠인터내셔널코리아(유),Sr. QA/Test Specialist 스크랩,/zf_user/jobs/relay/view?view_type=list&rec_idx=49489379,"웹개발, QA/테스터, Git, Spring, SpringBoot",서울전체 외
1445,(주)서플러스글로벌,데이터베이스 관리자 스크랩,/zf_user/jobs/relay/view?view_type=list&rec_idx=49473858,"웹개발, DBA, DBMS, RDBMS, MariaDB",경기전체 외
1446,(주)데이터유니버스,[신입/경력] Backend 개발자 채용 스크랩,/zf_user/jobs/relay/view?view_type=list&rec_idx=49460689,"백엔드/서버개발, Linux, MySQL, 빅데이터, 인프라",서울 영등포구
1447,(주)데이터유니버스,[경력] QA 엔지니어 채용 스크랩,/zf_user/jobs/relay/view?view_type=list&rec_idx=49544020,"프론트엔드, QA/테스터, S/W, Android, Docker",서울 영등포구
1448,(주)인이지,[INEEJI] (주)인이지 제조 AI 시스템 개발자 채용 스크랩,/zf_user/jobs/relay/view?view_type=list&rec_idx=49621694,"백엔드/서버개발, SE(시스템엔지니어), AI(인공지능), 인터페이스, AWS",경기 성남시 분당구
1449,㈜하우리,"(주)하우리 기술지원센터 신입 / 경력직 채용 (서울,대전) 스크랩",/zf_user/jobs/relay/view?view_type=list&rec_idx=49621661,"기술지원, 유지보수, 정보보안, 솔루션, 클라이언트",서울 종로구
1450,(주)에스앤이컴퍼니,[서초구 벤처기업] 데이터 사이언티스트 경력직 채용 스크랩,/zf_user/jobs/relay/view?view_type=list&rec_idx=49621575,"데이터분석가, 데이터엔지니어, 딥러닝, 머신러닝, Python",서울 서초구
