job_list_id,Company,Title,Link,Job,Location
1,(주)휴머스온,2025년도 휴머스온 대규모 채용 상반기 SW/Biz 공채 경력공채 스크랩,/zf_user/jobs/relay/view?view_type=list&rec_idx=49593871&adsCategoryItem=effect_bold&,"데이터엔지니어, 백엔드/서버개발, 보안컨설팅, 앱개발, 웹개발",서울 강남구
2,(주)풀무원,풀무원 각 부문 경력?신입 모집 스크랩,/zf_user/jobs/relay/view?view_type=list&rec_idx=49619144&adsCategoryItem=effect_bold&,"데이터분석가, 데이터엔지니어, 백엔드/서버개발, 보안컨설팅, 앱개발",서울 강남구 외
3,청오디피케이(주),도미노피자 각 부문(자회사 포함) 공개 채용 스크랩,/zf_user/jobs/relay/view?view_type=list&rec_idx=49652286,"기술지원, 데이터분석가, 데이터엔지니어, 백엔드/서버개발, 보안컨설팅",서울 강남구 외
4,(주)그린카,2025 그린카 경력/신입 상시 모집 스크랩,/zf_user/jobs/relay/view?view_type=list&rec_idx=49655813,"기술지원, 데이터분석가, 데이터엔지니어, 백엔드/서버개발, 보안컨설팅",서울 강남구 외
5,(주)메타엠,[메타엠]AICC R&D실/개발실/A솔루션실 개발자 채용 스크랩,/zf_user/jobs/relay/view?view_type=list&rec_idx=49460113,"데이터엔지니어, 백엔드/서버개발, 앱개발, 웹개발, 프론트엔드",서울 중구
6,(주)세종분석연구원,입찰분석연구원 외 각 부문별 신입 및 경력사원 모집 스크랩,/zf_user/jobs/relay/view?view_type=list&rec_idx=46521833,"기술지원, 데이터분석가, 데이터엔지니어, 백엔드/서버개발, 앱개발",서울 마포구 외
7,(주)지엠티,스마트 모빌리티 사업부 기술개발 소프트웨어 개발 경력자 채용 스크랩,/zf_user/jobs/relay/view?view_type=list&rec_idx=49597483,"데이터엔지니어, 백엔드/서버개발, 앱개발, 웹개발, 프론트엔드",세종 세종특별자치시
8,지에스차지비(주),[GS차지비㈜] 하반기 각 부문 신입 및 경력 채용 스크랩,/zf_user/jobs/relay/view?view_type=list&rec_idx=49584563,"기술지원, 데이터분석가, 데이터엔지니어, 백엔드/서버개발, 앱개발",서울 서초구 외
9,센시 주식회사,[센시] JAVA 기반 백엔드 /  프론트엔드 웹서비스 개발자 스크랩,/zf_user/jobs/relay/view?view_type=list&rec_idx=49596139,"데이터분석가, 데이터엔지니어, 백엔드/서버개발, 앱개발, 웹개발",서울 강남구
10,쿠도커뮤니케이션(주),[쿠도커뮤니케이션] DX사업부 개발자(IOS 서비스앱) 경력직 채용 스크랩,/zf_user/jobs/relay/view?view_type=list&rec_idx=49577921,"기술지원, 데이터엔지니어, 백엔드/서버개발, 앱개발, 웹개발",경기 과천시
11,(주)테이아,(주)테이아 현대모비스 PLM 운영 경력직 채용 스크랩,/zf_user/jobs/relay/view?view_type=list&rec_idx=49533096,"데이터분석가, 데이터엔지니어, 백엔드/서버개발, 앱개발, 웹개발",경기 과천시
12,(주)이수시스템,이수시스템 24년 경력직 채용 스크랩,/zf_user/jobs/relay/view?view_type=list&rec_idx=48765387,"기술지원, 데이터분석가, 데이터엔지니어, 백엔드/서버개발, 보안컨설팅",서울 서초구 외
13,(주)이노룰스,이노룰스 2025년도 신입 및 경력사원 공채 스크랩,/zf_user/jobs/relay/view?view_type=list&rec_idx=49651883,"기술지원, 데이터분석가, 데이터엔지니어, 백엔드/서버개발, 앱개발",서울 송파구 외
14,한국기술교육직업전문학교,[전액국비] Ai+JAVA풀스택/AWS클라우드보안 취업연계 모집중 스크랩,/zf_user/jobs/relay/view?view_type=list&rec_idx=45987137&adsCategoryItem=effect_bold&,"게임개발, 기술지원, 데이터분석가, 데이터엔지니어, 백엔드/서버개발",부산 동래구 외
15,(주)덴컴,[음성 AI 선두기업 덴컴] 백엔드 개발자 모집 스크랩,/zf_user/jobs/relay/view?view_type=list&rec_idx=49620184,"기술지원, 데이터엔지니어, 백엔드/서버개발, 앱개발, 웹개발",서울 강남구 외
16,(주)크리에이티브소프트,JAVA 서버 신입/경력 개발자 지원 부분 스크랩,/zf_user/jobs/relay/view?view_type=list&rec_idx=49611809,"백엔드/서버개발, 앱개발, 웹개발, 프론트엔드, HTML",서울 동작구
17,(주)푸드테크,㈜푸드테크 하반기 신입/경력 전부문 채용 스크랩,/zf_user/jobs/relay/view?view_type=list&rec_idx=49525316,"기술지원, 데이터분석가, 데이터엔지니어, 백엔드/서버개발, 앱개발",서울 강남구 외
18,(주)더코더,"웹 개발자 (FRONT, BACKEND, FULLSTACK) 스크랩",/zf_user/jobs/relay/view?view_type=list&rec_idx=49557686,"기술지원, 백엔드/서버개발, 앱개발, 웹개발, 프론트엔드",경기 고양시 덕양구
19,(주)포네트,경력 개발자 채용 - 분당 본사 스크랩,/zf_user/jobs/relay/view?view_type=list&rec_idx=49578787,"데이터엔지니어, 백엔드/서버개발, 앱개발, 웹개발, 프론트엔드",경기 성남시 분당구 외
20,(주)퍼스트씨앤디,"충전기, 모빌리티 운영플랫폼 개발 및 빅데이터 처리 엔지니어 스크랩",/zf_user/jobs/relay/view?view_type=list&rec_idx=49600472,"데이터분석가, 백엔드/서버개발, 앱개발, 웹개발, 유지보수",경기 화성시
21,(주)크리젠솔루션,[신입] 금융솔루션 개발 및 유지보수 담당자 모집 스크랩,/zf_user/jobs/relay/view?view_type=list&rec_idx=49598814,"백엔드/서버개발, 앱개발, 웹개발, 프론트엔드, Ajax",서울 구로구
22,(주)케이티디에스,[kt ds] 2024년 각 부문별 경력사원 상시채용 스크랩,/zf_user/jobs/relay/view?view_type=list&rec_idx=49444384,"게임개발, 데이터분석가, 데이터엔지니어, 백엔드/서버개발, 보안컨설팅",서울 서초구
23,(주)메인,프런트엔드 React 개발자 경력자 채용 스크랩,/zf_user/jobs/relay/view?view_type=list&rec_idx=49500867,"백엔드/서버개발, 앱개발, 웹개발, 프론트엔드, Java",서울 서초구
24,(주)포네트,신입 개발자 채용 - 분당 본사 스크랩,/zf_user/jobs/relay/view?view_type=list&rec_idx=49580246,"데이터엔지니어, 백엔드/서버개발, 앱개발, 웹개발, 프론트엔드",경기 성남시 분당구 외
25,주식회사 핌아시아,[핌아시아 떠리몰] 이커머스 MD/개발/서비스기획/마케팅/디자인 스크랩,/zf_user/jobs/relay/view?view_type=list&rec_idx=49498404,"데이터엔지니어, 백엔드/서버개발, 앱개발, 웹개발, 프론트엔드",서울 강남구 외
26,(주)클로잇,[클로잇] TA / AA / Consultant 직군 채용 (경력) 스크랩,/zf_user/jobs/relay/view?view_type=list&rec_idx=49570258,"기술지원, 백엔드/서버개발, 앱개발, 웹개발, 유지보수",서울 중구
27,(주)아이티공간,SI : 웹 : 시스템 : 프로젝트 개발 PL PM 프로그램 개발자 스크랩,/zf_user/jobs/relay/view?view_type=list&rec_idx=49334900,"기술지원, 데이터분석가, 데이터엔지니어, 백엔드/서버개발, 앱개발",부산 기장군 외
28,(주)테라젠헬스,(주)테라젠헬스 IT팀 웹개발자 경력 채용 스크랩,/zf_user/jobs/relay/view?view_type=list&rec_idx=49551621,"기술지원, 백엔드/서버개발, 앱개발, 웹개발, 웹마스터",경기 성남시 분당구
29,(주)쇼엠,[인천 송도 근무] 파이썬 개발자 사원 채용 스크랩,/zf_user/jobs/relay/view?view_type=list&rec_idx=49536040,"기술지원, 백엔드/서버개발, 앱개발, 웹개발, 유지보수",인천 연수구 외
30,넛지헬스케어(주),[넛지헬스케어] 백엔드개발 채용전환형 인턴 스크랩,/zf_user/jobs/relay/view?view_type=list&rec_idx=49523378,"백엔드/서버개발, 앱개발, 웹개발, 웹마스터, 유지보수",서울 강남구
31,(주)누리어시스템,"[금융SM] 손해보험 운영 정규직 웹/앱 개발자 (Java, jsp) 스크랩",/zf_user/jobs/relay/view?view_type=list&rec_idx=49535028,"백엔드/서버개발, 앱개발, 웹개발, 유지보수, 프론트엔드",서울 서대문구 외
32,(주)이지미디어,웹/모바일 개발자 경력직 모집(운영연구개발팀) 스크랩,/zf_user/jobs/relay/view?view_type=list&rec_idx=49520882,"백엔드/서버개발, 앱개발, 웹개발, 프론트엔드, Android",서울 구로구
33,주식회사 이지서티,[이지서티] 호남지사(광주) 솔루션 엔지니어 경력사원 채용 스크랩,/zf_user/jobs/relay/view?view_type=list&rec_idx=49511707,"기술지원, 데이터분석가, 데이터엔지니어, 백엔드/서버개발, 웹개발",광주 동구
34,(주)이지미디어,웹/모바일 JAVA 개발자 경력직 모집(개발팀) 스크랩,/zf_user/jobs/relay/view?view_type=list&rec_idx=49504344,"백엔드/서버개발, 앱개발, 웹개발, 프론트엔드, Android",서울 구로구
35,(주)위펀,(주)위펀 - Backend Engineer 스크랩,/zf_user/jobs/relay/view?view_type=list&rec_idx=49373335,"백엔드/서버개발, 앱개발, 웹개발, 웹마스터, 유지보수",서울 강남구 외
36,(주)위펀,(주)위펀 - Frontend Engineer (React) 스크랩,/zf_user/jobs/relay/view?view_type=list&rec_idx=49373304,"백엔드/서버개발, 앱개발, 웹개발, 웹마스터, 유지보수",서울 강남구 외
37,넛지헬스케어(주),[넛지헬스케어] 풀스택개발 산업기능요원 (병역특례) 스크랩,/zf_user/jobs/relay/view?view_type=list&rec_idx=49437986,"데이터분석가, 데이터엔지니어, 백엔드/서버개발, 앱개발, 웹개발",서울 강남구
38,모노얼라이언스주식회사,웹 개발자 (JAVA) 경력(정규직) /개발/운영/유지 스크랩,/zf_user/jobs/relay/view?view_type=list&rec_idx=49434522,"백엔드/서버개발, 앱개발, 웹개발, 프론트엔드, Ajax",서울 구로구
39,기적기획,[신입/경력] 웹퍼블리셔 및 프론트엔드 개발자 채용 스크랩,/zf_user/jobs/relay/view?view_type=list&rec_idx=49433348,"백엔드/서버개발, 앱개발, 웹개발, 웹마스터, 유지보수",서울 강남구
40,주식회사식자재쿡,"프론트, 백엔드 앱 개발자 채용 [부산본사, 서울지사 근무] 스크랩",/zf_user/jobs/relay/view?view_type=list&rec_idx=49352854,"기술지원, 백엔드/서버개발, 앱개발, 웹개발, 웹마스터",부산 수영구
41,(주)세이브프롬,각 부문별 신입 및 경력 채용 / 프로그래머 스크랩,/zf_user/jobs/relay/view?view_type=list&rec_idx=49359252,"기술지원, 데이터엔지니어, 백엔드/서버개발, 앱개발, 웹개발",서울 성동구 외
42,람정제주개발(주),제주신화월드 IT 부문 정규직 모집 스크랩,/zf_user/jobs/relay/view?view_type=list&rec_idx=49314263,"기술지원, 데이터분석가, 데이터엔지니어, 백엔드/서버개발, 앱개발",제주 서귀포시
43,(주)클로잇,[클로잇] 엔터프라이즈산업 경력직 공개채용 스크랩,/zf_user/jobs/relay/view?view_type=list&rec_idx=49331377,"기술지원, 데이터분석가, 데이터엔지니어, 백엔드/서버개발, 앱개발",서울 중구
44,(주)마더케이,[사업확장] 각 부문 신규 채용 스크랩,/zf_user/jobs/relay/view?view_type=list&rec_idx=48917246&adsCategoryItem=effect_bold&,"기술지원, 백엔드/서버개발, 앱개발, 웹개발, 유지보수",경기 성남시 분당구 외
45,(주)에스티에이테스팅컨설팅,[ISTQB 교육/자격시험 지원]SW 테스트 엔지니어 모집(이커머스 부문) 스크랩,/zf_user/jobs/relay/view?view_type=list&rec_idx=49645961&adsCategoryItem=effect_bold&,"게임개발, 기술지원, 데이터분석가, 데이터엔지니어, 백엔드/서버개발",서울 중구 외
46,(주)에스티에이테스팅컨설팅,[ISTQB 교육/자격시험 지원]SW 테스트 엔지니어 모집 스크랩,/zf_user/jobs/relay/view?view_type=list&rec_idx=49645923&adsCategoryItem=effect_bold&,"게임개발, 기술지원, 데이터분석가, 데이터엔지니어, 백엔드/서버개발",서울 중구 외
47,(사)한국선급,2024년도 한국선급 직원(정규직) 채용 공고 스크랩,/zf_user/jobs/relay/view?view_type=list&rec_idx=49482645,"데이터엔지니어, 백엔드/서버개발, 앱개발, 유지보수, 정보보안",부산 강서구 외
48,(주)대유넥스티어,Salesforce 개발자 경력 인재영입 스크랩,/zf_user/jobs/relay/view?view_type=list&rec_idx=49668926,"백엔드/서버개발, 앱개발, 웹개발, 웹마스터, 유지보수",서울 성동구
49,에이엠(주),에이엠㈜ 신입/경력 채용 모집 스크랩,/zf_user/jobs/relay/view?view_type=list&rec_idx=49598664,"기술지원, 데이터분석가, 데이터엔지니어, 백엔드/서버개발, 보안컨설팅",경기 과천시 외
50,성남그린컴퓨터아카데미,"IT 개발자 강사구인(국기, KDT, 풀스택, AI, 빅데이터등) 스크랩",/zf_user/jobs/relay/view?view_type=list&rec_idx=49665130,"데이터분석가, 데이터엔지니어, 백엔드/서버개발, 앱개발, 웹개발",경기 성남시 분당구
51,(주)누리어시스템,"[기술연구소] 솔루션(Java, jsp) 개발자 채용 스크랩",/zf_user/jobs/relay/view?view_type=list&rec_idx=49664184,"백엔드/서버개발, 앱개발, 웹개발, 유지보수, 프론트엔드",경기 하남시 외
52,(주)엔디소프트,"개발자,AI/데이터 신입/경력. 스크랩",/zf_user/jobs/relay/view?view_type=list&rec_idx=49655852,"데이터분석가, 데이터엔지니어, 백엔드/서버개발, 앱개발, 웹개발",부산 해운대구
53,(주)엔디소프트,"개발자,AI/데이터 신입/경력 모집 스크랩",/zf_user/jobs/relay/view?view_type=list&rec_idx=49655868,"데이터분석가, 데이터엔지니어, 백엔드/서버개발, 앱개발, 웹개발",서울 강남구
54,상상스토리(주),상상스토리(주) 2025년 상반기 신입 공개 채용 공고 스크랩,/zf_user/jobs/relay/view?view_type=list&rec_idx=49646313,"백엔드/서버개발, 앱개발, 웹개발, 유지보수, 프론트엔드",서울 구로구
55,(주)스쿨버스,스쿨버스 백엔드 개발자 / 플로터 Flutter 개발자 채용(경력1년) 스크랩,/zf_user/jobs/relay/view?view_type=list&rec_idx=49425574,"백엔드/서버개발, 앱개발, 웹개발, 유지보수, 프론트엔드",서울 강서구
56,(주)에이아이매틱스,연구개발(펌웨어/ CAN분석) 개발자 채용 스크랩,/zf_user/jobs/relay/view?view_type=list&rec_idx=49623348,"데이터분석가, 데이터엔지니어, 백엔드/서버개발, 웹개발, 웹마스터",경기 성남시 분당구 외
57,(주)토마토시스템,[(주)토마토시스템] 모바일 개발자 채용(경력) 스크랩,/zf_user/jobs/relay/view?view_type=list&rec_idx=49629061,"기술지원, 데이터분석가, 백엔드/서버개발, 앱개발, 웹개발",서울 강남구
58,(주)에이아이매틱스,연구개발(알고리즘개발) 담당자 채용 스크랩,/zf_user/jobs/relay/view?view_type=list&rec_idx=49568758,"데이터분석가, 데이터엔지니어, 백엔드/서버개발, 웹개발, 웹마스터",경기 성남시 분당구 외
59,(주)스포티비,[SPOTV] 서비스기획 담당자 채용 스크랩,/zf_user/jobs/relay/view?view_type=list&rec_idx=49618679,"기술지원, 데이터분석가, 데이터엔지니어, 백엔드/서버개발, 앱개발",서울 마포구
60,(주)엑스큐어넷,IT 보안솔루션 개발자 채용(Content Filter) 스크랩,/zf_user/jobs/relay/view?view_type=list&rec_idx=49606926,"데이터분석가, 데이터엔지니어, 백엔드/서버개발, 보안컨설팅, 앱개발",서울 은평구
61,딱플(주),[딱플] 개발팀 퍼블리셔 경력자 모십니다. 스크랩,/zf_user/jobs/relay/view?view_type=list&rec_idx=49497316,"기술지원, 백엔드/서버개발, 앱개발, 웹개발, 웹마스터",충남 천안시 서북구
62,(주)스마트마켓서비스,웹 전문 개발자 모집합니다 스크랩,/zf_user/jobs/relay/view?view_type=list&rec_idx=49590008,"백엔드/서버개발, 앱개발, 웹개발, 유지보수, 프론트엔드",서울 구로구
63,(주)데일리앤코,"[클럭, 몽제] 디자인그룹 웹퍼블리셔 부문 추가 채용 스크랩",/zf_user/jobs/relay/view?view_type=list&rec_idx=49573489,"백엔드/서버개발, 앱개발, 웹개발, 웹마스터, 유지보수",서울 송파구
64,(주)한국지에스티,2024년도 개발자(경력) 채용 공고 스크랩,/zf_user/jobs/relay/view?view_type=list&rec_idx=49569946,"백엔드/서버개발, 앱개발, 웹개발, 유지보수, 프론트엔드",서울 광진구
65,(주)토마토시스템,[(주)토마토시스템] 분석/설계 및 개발자 채용(경력) 스크랩,/zf_user/jobs/relay/view?view_type=list&rec_idx=49568500,"기술지원, 데이터분석가, 백엔드/서버개발, 앱개발, 웹개발",서울 강남구
66,(주)누리어시스템,"[금융SI, SM] Java, JSP 웹 개발자를 모십니다. 스크랩",/zf_user/jobs/relay/view?view_type=list&rec_idx=49559958,"백엔드/서버개발, 앱개발, 웹개발, 유지보수, 프론트엔드",경기 하남시 외
67,아우토크립트(주),아우토크립트 인재풀 스크랩,/zf_user/jobs/relay/view?view_type=list&rec_idx=49536642,"데이터분석가, 데이터엔지니어, 백엔드/서버개발, 보안컨설팅, 앱개발",서울 영등포구
68,유한책임회사앤서스랩코리아,[외국계/게임사]게임 개발자 모집(Developer) 스크랩,/zf_user/jobs/relay/view?view_type=list&rec_idx=49541202,"게임개발, 데이터엔지니어, 백엔드/서버개발, 앱개발, 웹개발",서울 강남구
69,(주)온택트헬스,윈도우 애플리케이션 개발자 채용 스크랩,/zf_user/jobs/relay/view?view_type=list&rec_idx=49324582,"기술지원, 데이터분석가, 데이터엔지니어, 백엔드/서버개발, 앱개발",서울 서대문구
70,(주)이노그리드,(주)이노그리드 D.Tech센터 web3 개발팀(백엔드) 경력직 채용 스크랩,/zf_user/jobs/relay/view?view_type=list&rec_idx=49524043,"데이터분석가, 데이터엔지니어, 백엔드/서버개발, 앱개발, 웹개발",서울 중구 외
71,(주)앤씨앤,"[앤씨앤/넥스트칩] 2024년 12월 연구소, 영업마케팅 각 부문 모집 스크랩",/zf_user/jobs/relay/view?view_type=list&rec_idx=49488636,"데이터분석가, 데이터엔지니어, 백엔드/서버개발, 앱개발, 유지보수",경기 성남시 분당구 외
72,(주)헥토이노베이션,헥토이노베이션 직군별 인재 모집 스크랩,/zf_user/jobs/relay/view?view_type=list&rec_idx=49506813,"데이터분석가, 백엔드/서버개발, 앱개발, 웹개발, 웹마스터",서울 강남구 외
73,(주)케이씨넷,[KCNET] 관세청 프로그램 개발자 계약직 모집[대전] 스크랩,/zf_user/jobs/relay/view?view_type=list&rec_idx=49504812,"백엔드/서버개발, 앱개발, 웹개발, 유지보수, 프론트엔드",대전 서구 외
74,한국폴리텍대학 광명융합기술교육원,데이터분석/바이오/설계/AR/VR/전기 취업연계 교육생 모집 스크랩,/zf_user/jobs/relay/view?view_type=list&rec_idx=49188717,"기술지원, 데이터분석가, 데이터엔지니어, 백엔드/서버개발, 앱개발",경기전체 외
75,(주)스카이오토넷,(주)스카이오토넷 - 영상처리 개발자(병역특례가능) 스크랩,/zf_user/jobs/relay/view?view_type=list&rec_idx=49356314,"백엔드/서버개발, 앱개발, 웹개발, 유지보수, 정보보안",서울 서초구 외
76,(주)스카이오토넷,자율주행S/W 개발자 채용 스크랩,/zf_user/jobs/relay/view?view_type=list&rec_idx=49438952,"백엔드/서버개발, 앱개발, 웹개발, 유지보수, 정보보안",서울 서초구 외
77,(주)데이터마케팅코리아,(주)데이터마케팅코리아 데이터 엔지니어링 직무 채용 스크랩,/zf_user/jobs/relay/view?view_type=list&rec_idx=49373556,"데이터엔지니어, 백엔드/서버개발, 앱개발, 웹개발, 유지보수",서울 강남구
78,주식회사오프리메드,2025년 (주)오프리메드 상반기 프론트엔드 개발자 공개채용 스크랩,/zf_user/jobs/relay/view?view_type=list&rec_idx=49663279,"기술지원, 데이터분석가, 데이터엔지니어, 앱개발, 웹개발",경기 수원시 영통구
79,(주)엔디소프트,"PM,QA/TEST 신입/경력. 스크랩",/zf_user/jobs/relay/view?view_type=list&rec_idx=49655823,"앱개발, 웹개발, 프론트엔드, QA/테스터, 딥러닝",부산 해운대구
80,(주)엔디소프트,"PM,QA/TEST 신입/경력 모집 스크랩",/zf_user/jobs/relay/view?view_type=list&rec_idx=49655881,"앱개발, 웹개발, 프론트엔드, QA/테스터, 딥러닝",서울 강남구
81,(주)엠투피아이,PHP 웹개발자 채용 (경력 3~5년) 스크랩,/zf_user/jobs/relay/view?view_type=list&rec_idx=49660231,"백엔드/서버개발, 웹개발, 퍼블리셔, 프론트엔드, DBA",서울 성동구 외
82,(주)엠투피아이,PHP 웹개발자 채용 (경력 6~8년) 스크랩,/zf_user/jobs/relay/view?view_type=list&rec_idx=49660226,"백엔드/서버개발, 웹개발, 퍼블리셔, 프론트엔드, DBA",서울 성동구 외
83,망고카(주),[망고카] 플랫폼 개발 팀장 경력 채용 스크랩,/zf_user/jobs/relay/view?view_type=list&rec_idx=49660147,"백엔드/서버개발, 웹개발, 웹마스터, 프론트엔드, DBA",서울 영등포구
84,디포커스(주),"웹개발자 (C#, Java) 신입 / 경력 정규직 채용 (서울 본사 상주) 스크랩",/zf_user/jobs/relay/view?view_type=list&rec_idx=49659539,"백엔드/서버개발, 웹개발, 프론트엔드, 클라우드, ASP.NET",서울 성동구
85,한국가이던스,열정과 소통능력이 좋은 풀스택 개발자(지원자 수시 확인중) 스크랩,/zf_user/jobs/relay/view?view_type=list&rec_idx=49648934,"백엔드/서버개발, 앱개발, 웹개발, 퍼블리셔, 프론트엔드",대구 달서구 외
86,(주)누리미디어,[개발운영] 네이티브 앱 개발자 (경력) 스크랩,/zf_user/jobs/relay/view?view_type=list&rec_idx=49636667,"백엔드/서버개발, 앱개발, 웹개발, 프론트엔드, 머신러닝",서울 마포구
87,(주)아이커넥트,[백엔드/프론트엔드 개발] (주)아이커넥트 웹개발자 채용 공고 스크랩,/zf_user/jobs/relay/view?view_type=list&rec_idx=49593981,"백엔드/서버개발, 앱개발, 웹개발, 프론트엔드, 클라우드",대구 북구
88,(주)셀버스,[셀버스] FrontEnd/BackEnd 개발 및 유지보수 개발자 모집 스크랩,/zf_user/jobs/relay/view?view_type=list&rec_idx=49370294,"백엔드/서버개발, 앱개발, 웹개발, 유지보수, SI개발",서울 중구
89,(주)지냄,백엔드 개발자 채용 [7~10년] 스크랩,/zf_user/jobs/relay/view?view_type=list&rec_idx=49628049,"백엔드/서버개발, 웹개발, 프론트엔드, SE(시스템엔지니어), 인프라",부산전체 외
90,(주)아이넵,풀스택 개발자 모집[계약직] 스크랩,/zf_user/jobs/relay/view?view_type=list&rec_idx=49630350,"데이터분석가, 백엔드/서버개발, 웹개발, 퍼블리셔, 프론트엔드",서울 성동구 외
91,주식회사 패스트뷰,프론트엔드 개발자 (3년 이상) 스크랩,/zf_user/jobs/relay/view?view_type=list&rec_idx=49625580,"백엔드/서버개발, 앱개발, 웹개발, 퍼블리셔, 프론트엔드",서울 강남구 외
92,주식회사 패스트뷰,시니어 풀스택 엔지니어 스크랩,/zf_user/jobs/relay/view?view_type=list&rec_idx=49625596,"백엔드/서버개발, 웹개발, 퍼블리셔, 프론트엔드, ECMAScript",서울 강남구 외
93,(주)지냄,백엔드 개발자 채용 [4~6년] 스크랩,/zf_user/jobs/relay/view?view_type=list&rec_idx=49628055,"백엔드/서버개발, 웹개발, 프론트엔드, SE(시스템엔지니어), 인프라",부산전체 외
94,(주)엔미디어플랫폼,window application 개발 엔지니어 인재모집 (4~8년) 스크랩,/zf_user/jobs/relay/view?view_type=list&rec_idx=49626613,"백엔드/서버개발, 웹개발, 프론트엔드, C++, C언어",서울전체 외
95,(주)아이넵,풀스택 개발자 모집 스크랩,/zf_user/jobs/relay/view?view_type=list&rec_idx=49630346,"데이터분석가, 백엔드/서버개발, 웹개발, 퍼블리셔, 프론트엔드",서울 성동구 외
96,아타드(주),"[VPN] 백엔드, 서버 개발자 채용 스크랩",/zf_user/jobs/relay/view?view_type=list&rec_idx=49626413,"백엔드/서버개발, 웹개발, 프론트엔드, SE(시스템엔지니어), 네트워크",서울 강남구 외
97,(주)엔미디어플랫폼,window application 개발 엔지니어 인재모집 (1~3년) 스크랩,/zf_user/jobs/relay/view?view_type=list&rec_idx=49626603,"백엔드/서버개발, 웹개발, 프론트엔드, C++, C언어",서울전체 외
98,(주)엔미디어플랫폼,window application 개발 엔지니어 인재모집 (신입) 스크랩,/zf_user/jobs/relay/view?view_type=list&rec_idx=49626610,"백엔드/서버개발, 웹개발, 프론트엔드, C++, C언어",서울전체 외
99,(주)위버케어,프론트엔드 개발자 (병역특례 가능) 스크랩,/zf_user/jobs/relay/view?view_type=list&rec_idx=49618887,"백엔드/서버개발, 앱개발, 웹개발, 프론트엔드, Android",서울 강남구 외
100,(주)덴컴,백엔드 개발자 스크랩,/zf_user/jobs/relay/view?view_type=list&rec_idx=49622638,"백엔드/서버개발, 웹개발, 프론트엔드, DBA, SE(시스템엔지니어)",서울 강남구 외
101,(주)중독컴퍼니,[카페인중독]본사 앱 풀스택 개발자 모집(무료구내식당) 스크랩,/zf_user/jobs/relay/view?view_type=list&rec_idx=49535063,"백엔드/서버개발, 앱개발, 웹개발, 유지보수, 정보보안",서울 강남구
102,한국모바일인증(주),한국모바일인증(주) IT개발 및 운영 정규직 채용 스크랩,/zf_user/jobs/relay/view?view_type=list&rec_idx=49526283,"백엔드/서버개발, 앱개발, 웹개발, 정보보안, 프론트엔드",서울 구로구
