job_list_id,Company,Title,Link,Job,Location
433,스퀘어네트(주),Python 개발자 채용 스크랩,/zf_user/jobs/relay/view?view_type=list&rec_idx=49638999,"웹개발, S/W, Java, Spring, SpringBoot",서울 강남구 외
434,(주)위드,java SI 및 SM 신입/경력 - 정규직 스크랩,/zf_user/jobs/relay/view?view_type=list&rec_idx=49638883,"웹개발, Ajax, Java, 유지보수",대전 서구 외
435,(주)휴먼컨설팅그룹,풀스택 개발자 (인사시스템) 스크랩,/zf_user/jobs/relay/view?view_type=list&rec_idx=49610457,"웹개발, 프론트엔드, DBA, ECMAScript, Java",경기전체 외
436,(주)넷앤드,[개발부문] 솔루션 패키지 쉘 개발 및 관리/배포 담당자 (경력) 스크랩,/zf_user/jobs/relay/view?view_type=list&rec_idx=49638432,"데이터엔지니어, 유지보수, 솔루션, 스크립트, 인프라",서울 영등포구
437,(주)지비소프트,앱 개발자 신규채용(신입/경력) 스크랩,/zf_user/jobs/relay/view?view_type=list&rec_idx=49474504,"앱개발, 유지보수, 정보보안, 빅데이터, 솔루션",서울 강남구
438,(주)우리기술,병역특례 전문연구요원 모집 스크랩,/zf_user/jobs/relay/view?view_type=list&rec_idx=49638232,"데이터분석가, 데이터엔지니어, 네트워크, 임베디드, 클라우드",서울 마포구
439,디지털메딕(주),Android Mobile APP 개발자 모집 스크랩,/zf_user/jobs/relay/view?view_type=list&rec_idx=49637125,"앱개발, 솔루션, Android, Git, Kotlin",서울 강남구
440,(주)알타바그룹,[AI LAB] 웹프론트 개발자 스크랩,/zf_user/jobs/relay/view?view_type=list&rec_idx=49637014,"웹개발, 프론트엔드, Node.js, React, WebGL",서울 강남구
441,(주)지비소프트,앱 개발자 신입/경력직 신규채용(대구근무) 스크랩,/zf_user/jobs/relay/view?view_type=list&rec_idx=49636348,"앱개발, 유지보수, 정보보안, 빅데이터, 솔루션",대구 수성구
442,주식회사 보다컴,2025년 상반기 시스템 엔지니어 신입 사원 모집 스크랩,/zf_user/jobs/relay/view?view_type=list&rec_idx=49636154,"기술지원, 백엔드/서버개발, 네트워크, 정보통신, 유지보수",서울 강서구
443,(주)되고시스템,[웹개발] JAVA 풀스택 개발자 경력 정규직 채용 스크랩,/zf_user/jobs/relay/view?view_type=list&rec_idx=49636038,"웹개발, iBATIS, Java, Javascript, JPA",대전 유성구
444,엔에스원소프트(주),[세종] 공공SI 프로젝트 PM/PL/리드급 개발자 스크랩,/zf_user/jobs/relay/view?view_type=list&rec_idx=49583128,"유지보수, 프론트엔드, SI개발, 개발PM",세종 세종특별자치시
445,미디어젠(주),[미디어젠(주)]음성제어서비스 개발 및 운영자 경력(정규직)채용 스크랩,/zf_user/jobs/relay/view?view_type=list&rec_idx=49635921,"앱개발, 음성인식, Java, Node.js, SpringBoot",서울 강서구
446,(주)비에스그룹,(주)비에스그룹 비에스디벨 신사업부 관리자 채용 스크랩,/zf_user/jobs/relay/view?view_type=list&rec_idx=49635810,"데이터분석가, 검색엔진, 솔루션, API, 광고마케팅",경기 수원시 권선구 외
447,다이나믹큐에스(유),윈도우 어플리케이션 개발자 채용 스크랩,/zf_user/jobs/relay/view?view_type=list&rec_idx=49635717,"C#, WPF, 유지보수, 프론트엔드, 머신러닝",서울 구로구
448,(주)케이엠디엠,백업 솔루션 기술지원 엔지니어 모집 스크랩,/zf_user/jobs/relay/view?view_type=list&rec_idx=49627792,"기술지원, 데이터엔지니어, 유지보수, IT컨설팅, 방화벽",서울 강남구
449,근남정보기술(주),[대전] Java (Spring) 웹 개발자 채용 (PM급) 스크랩,/zf_user/jobs/relay/view?view_type=list&rec_idx=49627715,"웹개발, 유지보수, IT컨설팅, 솔루션, C++",대전 서구
450,디딤365(주),클라우드 SA 신입/경력사원 영입 스크랩,/zf_user/jobs/relay/view?view_type=list&rec_idx=49626598,"데이터엔지니어, SE(시스템엔지니어), 클라우드, DevOps, 설계엔지니어",서울 구로구
451,(주)솔로몬텍,H그룹사 사내시스템 운영 경력 채용 스크랩,/zf_user/jobs/relay/view?view_type=list&rec_idx=49626281,"기술지원, 웹개발, 유지보수, Apache, Git",서울 영등포구
452,(주)뉴로코어,[하반기채용]Back-end 신입/경력 스크랩,/zf_user/jobs/relay/view?view_type=list&rec_idx=49366259,"백엔드/서버개발, 프론트엔드, 모델링, 솔루션, 인프라",서울 강남구
453,(주)성산기획,[반응형웹] 경력 웹퍼블리셔 모집 스크랩,/zf_user/jobs/relay/view?view_type=list&rec_idx=49625660,"웹개발, 퍼블리셔, 반응형웹, Bootstrap, HTML5",부산 금정구
454,(주)팀리부뜨,부산 AI 스타트업 팀리부뜨 - 프론트엔드 엔지니어 스크랩,/zf_user/jobs/relay/view?view_type=list&rec_idx=49625612,"프론트엔드, 유지보수, 솔루션, CSS, TypeScript",부산 남구
455,(주)이젬코,[ICT 사업본부] 개발자 신입 정규직 채용 스크랩,/zf_user/jobs/relay/view?view_type=list&rec_idx=49524650,"웹개발, 모의해킹, ERP, S/W, .NET",서울 성동구 외
456,(주)휴머스온,Front Engineer 스크랩,/zf_user/jobs/relay/view?view_type=list&rec_idx=49523331,"웹개발, 프론트엔드, ECMAScript, Javascript, Node.js",서울 강남구 외
457,(주)이너버스,통합보안관리 솔루션 기술 엔지니어(신입) 스크랩,/zf_user/jobs/relay/view?view_type=list&rec_idx=49521872,"보안컨설팅, 웹개발, 정보보안, CISO, SE(시스템엔지니어)",서울전체 외
458,(주)이너버스,통합보안관리 솔루션 기술 엔지니어(경력) 스크랩,/zf_user/jobs/relay/view?view_type=list&rec_idx=49521869,"보안컨설팅, 웹개발, 정보보안, CISO, SE(시스템엔지니어)",서울전체 외
459,(주)마카롱팩토리,프론트엔드 개발 (5년 이상) 스크랩,/zf_user/jobs/relay/view?view_type=list&rec_idx=49520624,"웹개발, 프론트엔드, React, ReactJS, API",경기전체 외
460,(주)버즈니,[홈쇼핑모아] 프론트엔드 엔지니어 (앱 개발자) 스크랩,/zf_user/jobs/relay/view?view_type=list&rec_idx=49519897,"웹개발, 퍼블리셔, 프론트엔드, 반응형웹, 웹표준·웹접근성",서울 관악구 외
461,(주)플랙스뉴럴랩스,플러터(Flutter) 경력 개발자 채용 스크랩,/zf_user/jobs/relay/view?view_type=list&rec_idx=49518818,"앱개발, Android, Flutter, iOS, 유지보수",서울 관악구 외
462,(주)잇올,프론트엔드 개발자 채용 [잇올 본사] 스크랩,/zf_user/jobs/relay/view?view_type=list&rec_idx=49514917,"웹개발, 프론트엔드, ECMAScript, Javascript, React",서울 서초구 외
463,윤회(주),CAREID 프론트엔드 엔지니어 스크랩,/zf_user/jobs/relay/view?view_type=list&rec_idx=49509887,"웹개발, 프론트엔드, ECMAScript, Javascript, React",서울 서대문구 외
464,제너레잇(주),React 프론트엔드 경력 개발자 채용 스크랩,/zf_user/jobs/relay/view?view_type=list&rec_idx=49509782,"웹개발, 프론트엔드, ECMAScript, Javascript, React",서울전체 외
465,(주)캐럿글로벌,프론트엔드 웹개발자 경력직 채용 스크랩,/zf_user/jobs/relay/view?view_type=list&rec_idx=49505363,"웹개발, 퍼블리셔, 프론트엔드, 반응형웹, 웹표준·웹접근성",서울 서초구 외
466,(주)해줌,[에너지IT기업] 프론트엔드 개발 팀장 스크랩,/zf_user/jobs/relay/view?view_type=list&rec_idx=49498486,"웹개발, 퍼블리셔, 프론트엔드, 반응형웹, 웹표준·웹접근성",서울전체 외
467,(주)파수,보안 솔루션 구축 엔지니어 스크랩,/zf_user/jobs/relay/view?view_type=list&rec_idx=49495639,"기술지원, 웹개발, DBA, SE(시스템엔지니어), Windows",서울 마포구 외
468,(주)에이스웍스코리아,자율주행 프론트엔드 개발 엔지니어 (전문연 가능) 스크랩,/zf_user/jobs/relay/view?view_type=list&rec_idx=49489045,"웹개발, 퍼블리셔, 프론트엔드, SE(시스템엔지니어), 반응형웹",서울 강남구 외
469,(주)발트루스트,Java 개발자 스크랩,/zf_user/jobs/relay/view?view_type=list&rec_idx=49482622,"웹개발, DBA, S/W, JPA, MariaDB",경기전체 외
470,리걸테크(주),"웹개발자(Python, DJango) 스크랩",/zf_user/jobs/relay/view?view_type=list&rec_idx=49466077,"백엔드/서버개발, 웹개발, 블록체인, Django, Python",서울 성동구 외
471,(주)이즈파크,PLM 시스템 운영/유지보수 스크랩,/zf_user/jobs/relay/view?view_type=list&rec_idx=47213279,"기술지원, 웹개발, DBA, S/W, Java",경남전체 외
472,덕산홀딩스(주),[울산] 덕산홀딩스(주)  정보운영그룹 정규직 채용 스크랩,/zf_user/jobs/relay/view?view_type=list&rec_idx=49621764,"기술지원, 데이터엔지니어, 보안컨설팅, 유지보수, 정보보안",울산 북구
473,주식회사 한국미래에너지,PHP 풀스택 웹 개발자 모집 스크랩,/zf_user/jobs/relay/view?view_type=list&rec_idx=49621750,"웹개발, 유지보수, API, Nginx, CSS",경기 부천시 원미구
474,주식회사 한국미래에너지,Flutter 앱 개발자 모집 스크랩,/zf_user/jobs/relay/view?view_type=list&rec_idx=49621567,"앱개발, 유지보수, API, Flutter",경기 부천시 원미구
475,어세스타,ASP.NET 개발자 (경력 1~4년) 모집 스크랩,/zf_user/jobs/relay/view?view_type=list&rec_idx=49621360,"웹개발, .NET, ASP.NET, MSSQL, VB.NET",서울 영등포구
476,(주)언플러,(경력) 프론트엔드 개발 스크랩,/zf_user/jobs/relay/view?view_type=list&rec_idx=49620773,"퍼블리셔, 웹표준·웹접근성, HTML, Javascript, MariaDB",서울 강남구
477,(주)빌드잇,[신입/경력] Web Front-end(프론트엔드) 엔지니어 채용 스크랩,/zf_user/jobs/relay/view?view_type=list&rec_idx=49618524,"퍼블리셔, 프론트엔드, S/W, Javascript, 유지보수",경기 성남시 분당구
478,엘에스이(주),2024년 엘에스이(주) 전산 신입/경력 채용 공고 스크랩,/zf_user/jobs/relay/view?view_type=list&rec_idx=49598450,"웹개발, 웹마스터, 유지보수, 인프라, ERP",경기 안성시 외
479,(주)하이데이타,"소프트웨어 개발자(프로그래머) 모집( 대전,구미,창원) 스크랩",/zf_user/jobs/relay/view?view_type=list&rec_idx=49618049,"앱개발, SI개발, 딥러닝, 머신러닝, 빅데이터",대전전체 외
480,(주)아리모아,JAVA / JSP 웹개발 경력직 채용.. 스크랩,/zf_user/jobs/relay/view?view_type=list&rec_idx=49561976,"웹개발, Java, JPA, Node.js, PostgreSQL",부산 연제구
481,(주)엔텍정보통신,"서버관제 채용(상암동, 경력무관) 스크랩",/zf_user/jobs/relay/view?view_type=list&rec_idx=49617669,"백엔드/서버개발, 유지보수, SE(시스템엔지니어), 인프라, 클라우드",서울 마포구 외
482,룬,[웹디자인/퍼블리셔] 중급 이상의 웹디자인/퍼블리셔를 모십니다 스크랩,/zf_user/jobs/relay/view?view_type=list&rec_idx=49617258,"퍼블리셔, 프론트엔드, 웹표준·웹접근성, 크로스브라우징, 유지보수",서울 강남구
483,(주)레드소프트,(주)레드소프트 JAVA 솔루션서버/웹개발 유지보수 경력사원 모집 스크랩,/zf_user/jobs/relay/view?view_type=list&rec_idx=49617226,"웹개발, 유지보수, Java, 솔루션, DBMS",서울 구로구
484,(주)한국기술마켓,[한국기술마켓] React & Next.js 프론트엔드 개발자 모집 스크랩,/zf_user/jobs/relay/view?view_type=list&rec_idx=49616798,"프론트엔드, 유지보수, Docker, Git, Jenkins",충남 천안시 서북구
485,(주)아이스크림아트,드로잉 프로그램 개발자 경력직(경력 10~13년) 모집 스크랩,/zf_user/jobs/relay/view?view_type=list&rec_idx=49603654,"웹개발, 프론트엔드, Javascript, Node.js, OpenGL",서울 강남구
486,(주)아이스크림아트,드로잉 프로그램 개발자 경력직(경력 13년↑) 모집 스크랩,/zf_user/jobs/relay/view?view_type=list&rec_idx=49603679,"웹개발, 프론트엔드, Javascript, Node.js, OpenGL",서울 강남구
487,아이디자인랩,"[한국어 학습 앱] 펀픽, 플러터(Flutter) 개발자 모집 공고 스크랩",/zf_user/jobs/relay/view?view_type=list&rec_idx=49616038,"앱개발, Android, Flutter, iOS, Kotlin",서울 마포구
488,조베이스(주),[프론트엔드] 프론트엔드개발자  경력직 모집 스크랩,/zf_user/jobs/relay/view?view_type=list&rec_idx=49394744,"웹개발, Angular, ECMAScript, HTML5, Javascript",서울 강남구
489,주식회사코어16,[프론트개발] 프론트엔드 엔지니어 모집 스크랩,/zf_user/jobs/relay/view?view_type=list&rec_idx=49615442,"백엔드/서버개발, 프론트엔드, MongoDB, Node.js, React",서울 영등포구
490,한진정보통신(주),경력직 개발자 모집 - 어플리케이션 개발 스크랩,/zf_user/jobs/relay/view?view_type=list&rec_idx=49614924,"웹개발, AWS, Java, Javascript, Kafka",서울 중구
491,(주)모든세븐,[웹개발] C# / ASP.NET / Window Server 스크랩,/zf_user/jobs/relay/view?view_type=list&rec_idx=49614209,"웹개발, .NET, ASP.NET, C#, 유지보수",서울 금천구
492,(주)프레이,"전산 인프라 엔지니어 정규직 채용 ( HCI, VMware 우대) 스크랩",/zf_user/jobs/relay/view?view_type=list&rec_idx=49614127,"백엔드/서버개발, 유지보수, SE(시스템엔지니어), 인프라, 클라우드",서울 강서구
493,다겸(주),기술지원 필드 엔지니어를 모집합니다. 스크랩,/zf_user/jobs/relay/view?view_type=list&rec_idx=49312489,"기술지원, 데이터엔지니어, 솔루션기술영업, 기술엔지니어, 현장관리자",서울 금천구
494,(주)에이텍씨앤,[서울/종로] SK실트론 OA 유지보수 담당 모집 스크랩,/zf_user/jobs/relay/view?view_type=list&rec_idx=49614031,"기술지원, 백엔드/서버개발, 유지보수, CISO, 네트워크",서울 종로구
495,리걸테크(주),"웹개발자(Python, DJango) 스크랩",/zf_user/jobs/relay/view?view_type=list&rec_idx=49613941,"백엔드/서버개발, 웹개발, 블록체인, Django, Python",서울 성동구 외
496,㈜엠투소프트,전자문서솔루션 엔지니어 채용(신입/경력) 스크랩,/zf_user/jobs/relay/view?view_type=list&rec_idx=49613837,"기술지원, 웹개발, Angular, CSS, HTML",서울 성동구
497,(주)큐드,[오산] 자동화 SW 개발 및 검증 인원 모집 스크랩,/zf_user/jobs/relay/view?view_type=list&rec_idx=49571297,"백엔드/서버개발, QA/테스터, H/W, S/W, 기술엔지니어",경기 오산시
498,(주)네오플,[네오플] 프로그래밍/기술지원 직군 분야별 모집(근무지:서울) 스크랩,/zf_user/jobs/relay/view?view_type=list&rec_idx=49409848,"게임개발, 백엔드/서버개발, 네트워크, 액션스크립트, C#",서울 강남구
499,(주)인투정보,인투정보에서 신규 개발자 (신입) 직원을 채용합니다. 스크랩,/zf_user/jobs/relay/view?view_type=list&rec_idx=49609690,"웹개발, 유지보수",경기 고양시 일산동구
500,(주)시큐온,보안 솔루션 지원 엔지니어 모집합니다. 스크랩,/zf_user/jobs/relay/view?view_type=list&rec_idx=49609469,"백엔드/서버개발, 유지보수, 정보보안, S/W, Apache",서울 관악구
501,굿어스데이터(주),Oracle 엔지니어 채용 스크랩,/zf_user/jobs/relay/view?view_type=list&rec_idx=49581938,"데이터엔지니어, 유지보수, DBA, 데이터마이닝, DBMS",서울 강남구
502,(주)제이엠소프트아이엔씨,자바 웹개발 경력직 모집 스크랩,/zf_user/jobs/relay/view?view_type=list&rec_idx=49609090,"백엔드/서버개발, Eclipse, Java, JSP, MySQL",경기 고양시 일산동구
503,인서트(주),[경력] 3년이상 프론트엔드 개발자 채용 스크랩,/zf_user/jobs/relay/view?view_type=list&rec_idx=49389056,"웹개발, 프론트엔드, CSS3, Django, Git",서울 서초구
504,(주)포스텍,"앱 개발자 모집(안드로이드셋탑,태블릿,웨어러블) 스크랩",/zf_user/jobs/relay/view?view_type=list&rec_idx=49608164,"앱개발, SDK, Android, AWS, Docker",부산 해운대구
505,(주)포스텍,프론트엔드 팀장/팀원 모집 스크랩,/zf_user/jobs/relay/view?view_type=list&rec_idx=49608092,"백엔드/서버개발, 프론트엔드, Nginx, Apache, ECMAScript",부산 해운대구
506,(주)체스트넛,대전/세종/전주/부산/광주 지방  웹개발 경력자 찾습니다. 스크랩,/zf_user/jobs/relay/view?view_type=list&rec_idx=49608064,"백엔드/서버개발, 웹개발, 퍼블리셔, Java, JSP",세종 세종특별자치시 외
507,㈜칸테크,BI 엔지니어 채용(신입·경력) 스크랩,/zf_user/jobs/relay/view?view_type=list&rec_idx=49607431,"데이터분석가, 데이터엔지니어, IT컨설팅, SI개발, 데이터시각화",서울 강남구
508,함께하는 세무회계,[백엔드] 세무회계  백엔드 개발자 모집 스크랩,/zf_user/jobs/relay/view?view_type=list&rec_idx=49607128,"백엔드/서버개발, 프론트엔드, API",서울 서초구
509,(주)마케팅몬스터,(주)마케팅몬스터 백엔드/서버개발자 경력직 채용 공고 스크랩,/zf_user/jobs/relay/view?view_type=list&rec_idx=49606939,"웹개발, IT컨설팅, ICT컨설팅, 백엔드/서버개발, DevOps",부산 해운대구
510,(주)이아이넷,[신입] PHP 개발자 모집 스크랩,/zf_user/jobs/relay/view?view_type=list&rec_idx=49606386,"웹개발, HTML, Javascript, jQuery, MySQL",경기 하남시
511,(주)아이페이지온,[아이페이지온] 웹 어플리케이션 프론트엔드 개발자 경력 채용 스크랩,/zf_user/jobs/relay/view?view_type=list&rec_idx=49606223,"웹개발, 프론트엔드, CSS, HTML, Javascript",서울 강남구
512,(주)엑스코어시스템,[엑스코어시스템] 웹 어플리케이션 개발자 (경력) 스크랩,/zf_user/jobs/relay/view?view_type=list&rec_idx=49606127,"웹개발, SI개발, IoT, S/W, Angular",세종 세종특별자치시
513,(주)5초광고,(주)5초광고 백엔드 개발자 모집 스크랩,/zf_user/jobs/relay/view?view_type=list&rec_idx=49606102,"백엔드/서버개발, AWS, Git, iBATIS, Java",서울 성동구
514,유니원아이앤씨(주),[경력] 프론트엔드 개발자 모집 - 대리급(3년이상) 스크랩,/zf_user/jobs/relay/view?view_type=list&rec_idx=49583650,"앱개발, 프론트엔드, 솔루션, CSS, HTML",서울 영등포구
515,(주)엑스코어시스템,[엑스코어시스템-축산ICT사업본부] 웹개발자(JAVA) 스크랩,/zf_user/jobs/relay/view?view_type=list&rec_idx=49583260,"앱개발, 웹개발, SI개발, Java, API",세종 세종특별자치시
516,(주)에이텐시스템,[서울형강소기업] 스마트오피스 솔루션 HW엔지니어 모집 스크랩,/zf_user/jobs/relay/view?view_type=list&rec_idx=49581908,"기술지원, 데이터엔지니어, 유지보수, 정보보안, SE(시스템엔지니어)",서울 금천구 외
517,인포뱅크(주),[iComm] UMS메시지/PUSH 서비스 개발 및 유지보수(JAVA) 스크랩,/zf_user/jobs/relay/view?view_type=list&rec_idx=49581692,"백엔드/서버개발, API, Java, Linux, MSSQL",경기 의왕시
518,(주)링네트,(주)링네트 네트워크 필드엔지니어 경력직 수시채용 스크랩,/zf_user/jobs/relay/view?view_type=list&rec_idx=49581570,"기술지원, 데이터엔지니어, 유지보수, CISO, 네트워크",서울 구로구
519,(주)타이거씨엔에스,"[웹개발] 프론트엔드(Svelte), 백엔드(Djnago, Node.js) 개발자 스크랩",/zf_user/jobs/relay/view?view_type=list&rec_idx=49580945,"웹개발, 프론트엔드, 클라우드, API, Angular",서울 성동구
520,스페이스맵(주),정규직 프론트엔드 개발 (3년이상~7년이하) 스크랩,/zf_user/jobs/relay/view?view_type=list&rec_idx=49580570,"프론트엔드, 유지보수, AWS, CSS3, HTML5",서울 성동구
521,유니코로지스틱스(주),물류 IT담당자(경력) 스크랩,/zf_user/jobs/relay/view?view_type=list&rec_idx=49571137,"기술지원, 웹개발, 유지보수, 정보보안, IT컨설팅",서울 중구
522,(주)세경멀티뱅크,웹개발자채용 스크랩,/zf_user/jobs/relay/view?view_type=list&rec_idx=49578390,"웹개발, 프론트엔드, API, DevOps, Nginx",서울 성북구
523,하이퍼커넥트 유한책임회사,[하이퍼커넥트] Media Server Engineer 스크랩,/zf_user/jobs/relay/view?view_type=list&rec_idx=49577799,"백엔드/서버개발, 유지보수, 네트워크, 인프라, 클라우드",서울 강남구
524,큐어스트림(주),SW개발팀 채용(프론트앤드&Firmware&SW QA & SW RA) 스크랩,/zf_user/jobs/relay/view?view_type=list&rec_idx=49576137,"앱개발, 웹표준·웹접근성, 임베디드, 크로스브라우징, MCU",서울 구로구
525,삼정KPMG,[삼정KPMG] ITS 웹프로그램 신입 개발자 채용 스크랩,/zf_user/jobs/relay/view?view_type=list&rec_idx=49575754,"웹개발, 유지보수, 정보통신, ASP, Java",서울 강남구
526,(주)위링,UIUX / 경력 웹퍼블리셔 프론트엔드 채용 스크랩,/zf_user/jobs/relay/view?view_type=list&rec_idx=49575724,"퍼블리셔, 웹표준·웹접근성, CSS, HTML, Javascript",강원 원주시
527,(주)이노웍스,웹프로그램(Nodejs) 개발 및 유지보수 모집 (주임급 이상) 스크랩,/zf_user/jobs/relay/view?view_type=list&rec_idx=49575496,"웹개발, 웹마스터, 웹기획, 유지보수, 클라우드",충남 천안시 동남구
528,(주)보스반도체,SOC TOP Design Enginer 스크랩,/zf_user/jobs/relay/view?view_type=list&rec_idx=49574736,"백엔드/서버개발, 프론트엔드, 스크립트, FPGA, MCU",경기 성남시 분당구
529,(주)보스반도체,SOC RTL Design/Verification Enginer 스크랩,/zf_user/jobs/relay/view?view_type=list&rec_idx=49574723,"백엔드/서버개발, 프론트엔드, 스크립트, FPGA, MCU",경기 성남시 분당구
530,(주)유아이에스,"IT 시스템 엔지니어(서버, 가상화, 클라우드) 신입 및 경력 채용 스크랩",/zf_user/jobs/relay/view?view_type=list&rec_idx=49514992,"프론트엔드, SE(시스템엔지니어), 방화벽, DBMS, DLP",대전 유성구
531,(주)한빛에스아이,"웹개발, 프론트/백엔드 서버개발, SI개발 정규직 채용(경력사원) 스크랩",/zf_user/jobs/relay/view?view_type=list&rec_idx=49547348,"백엔드/서버개발, 웹개발, SI개발, API, Node.js",서울 서초구
532,(주)플랙스,[Back-end] 내부 서비스 백앤드 개발 및 유지보수 스크랩,/zf_user/jobs/relay/view?view_type=list&rec_idx=49547273,"백엔드/서버개발, PHP, Python, 유지보수, API",경기 용인시 수지구
533,(주)이씨에스텔레콤,Cisco IPCC Field Engineer(경력 5년 이상) 채용 스크랩,/zf_user/jobs/relay/view?view_type=list&rec_idx=49544670,"데이터분석가, 백엔드/서버개발, 유지보수, SE(시스템엔지니어), 솔루션",서울 서초구 외
534,엔에이치엔(주),[NHN Dooray] 엔마스터 서비스 개발(아파트ERP) 스크랩,/zf_user/jobs/relay/view?view_type=list&rec_idx=49532612,"백엔드/서버개발, 프론트엔드, 클라우드, Java, Linux",경기 성남시 분당구
535,(주)메이크인,[문래/자체직전환]국내 자산관리기업 전산팀 채용 스크랩,/zf_user/jobs/relay/view?view_type=list&rec_idx=49546024,"기술지원, 데이터엔지니어, 유지보수, 정보보안, 네트워크",서울 영등포구 외
536,(주)오렌지테크,공공사업본부 엔지니어 정규직 채용 스크랩,/zf_user/jobs/relay/view?view_type=list&rec_idx=49531094,"기술지원, 데이터엔지니어, 보안컨설팅, 정보보안, SE(시스템엔지니어)",서울 강남구 외
537,똑똑(주),[경력] VC ERP 백엔드 팀장 (Java/Spring Boot) 스크랩,/zf_user/jobs/relay/view?view_type=list&rec_idx=49545389,"백엔드/서버개발, Java, 프론트엔드, 클라우드, DevOps",서울 성동구
538,(주)발렌라이프,[주식회사 발렌라이프] 쇼핑몰 디자이너 채용 (경력) 스크랩,/zf_user/jobs/relay/view?view_type=list&rec_idx=49347336,"유지보수, 퍼블리셔, 프론트엔드, 광고디자인, 애프터이펙트",서울 영등포구
539,(주)위키드스톰,솔루션 개발 경력직 채용 스크랩,/zf_user/jobs/relay/view?view_type=list&rec_idx=49544872,"백엔드/서버개발, 웹개발, 머신러닝, 빅데이터, AI(인공지능)",서울 강서구
540,(주)제이디디지털스튜디오,미디어아트 실감콘텐츠 인터랙티브 언리얼 개발자 모집 스크랩,/zf_user/jobs/relay/view?view_type=list&rec_idx=49544611,"게임개발, 기술지원, 백엔드/서버개발, 유지보수, SI개발",서울 관악구
541,(주)단꿈아이,[단꿈아이] 교육사업실 웹퍼블리셔 경력 채용 스크랩,/zf_user/jobs/relay/view?view_type=list&rec_idx=49544334,"웹개발, 웹마스터, 퍼블리셔, 반응형웹, 웹표준·웹접근성",경기 성남시 분당구
542,(주)디로그,UX/UI 디자인 및 웹 프론트엔드 개발자 모집(신입ㆍ경력) 스크랩,/zf_user/jobs/relay/view?view_type=list&rec_idx=49544242,"웹개발, 퍼블리셔, 프론트엔드, CSS, Javascript",서울 금천구
543,(주)디더블유아이,[경력] 모바일 솔루션 개발 및 운영 스크랩,/zf_user/jobs/relay/view?view_type=list&rec_idx=49544205,"앱개발, IoT, AI(인공지능), Windows, Android",서울 중구
544,(주)퍼브,2024 (주)퍼브 플랫폼본부 앱개발자 정규직 채용 스크랩,/zf_user/jobs/relay/view?view_type=list&rec_idx=49543820,"앱개발, API, Android, AWS, CSS3",경기 과천시
545,(주)와이앤씨스마트앱스,"Java 웹 프로그래머 모집 (정규직, 경력 7년 이상) 스크랩",/zf_user/jobs/relay/view?view_type=list&rec_idx=49543755,"웹개발, Java, JSP, OracleDB, Spring",서울 서초구
546,(주)아울시스템즈,보안 S/W개발 (C / C++) 신입 및 경력직 채용 공고 스크랩,/zf_user/jobs/relay/view?view_type=list&rec_idx=49434885,"백엔드/서버개발, 정보보안, 네트워크, 솔루션, Windows",서울 영등포구
